f000125,1194.320,1205.840,"Her fightings with her young neighbor had been the be ginnings of an affection; and this violent antagonism was no more than an equally violent innate passion for him, first showing under the form of opposition."
f000126,1205.840,1209.040,"She could remember nothing else than that she had always loved him."
f000127,1209.040,1216.480,"She laughed over her martial encounter with him Elective Affinities with weapons in her hand; she dwelt upon the delight of her feelings when he disarmed her."
f000128,1216.480,1228.040,"She imagined that it had given her the greatest happiness when he bound her; and whatever she had done afterward to injure him, or to vex him, presented itself to her as only an innocent means of attracting his attention."
f000129,1228.040,1229.880,"She cursed their separation."
f000130,1229.880,1232.960,"She bewailed the sleepy state into which she had fallen."
f000131,1232.960,1239.280,"She execrated the insidious lazy routine which had be trayed her into accepting so insignificant a bridegroom."
f000132,1239.280,1245.280,"She was transformed doubly transformed, forward or backward, whichever way we like to take it."
f000133,1245.280,1258.120,"She kept her feelings entirely to herself; but if any one could have divined them and shared them with her, he could not have blamed her : for indeed the bridegroom could not sustain a comparison with the other as soon as they were seen together."
f000134,1258.120,1264.680,"If a sort of regard to the one could not be refused, the other excited the fullest trust and confidence."
f000135,1264.680,1279.120,"If one made an agreeable acquaintance, the other we should desire for a companion; and in ex traordinary cases, where higher demands might have to be made on them, the bridegroom was a person to be utterly despaired of, while the other would give the feel ing of perfect security."
f000136,1279.120,1287.080,"There is a peculiar innate tact in women which dis covers to them differences of this kind; and they have cause as well as occasion to cultivate it."
f000137,1287.080,1307.800,"The more the fair bride was nourishing all these feel ings in secret, the less opportunity there was for any one to speak a word which could tell in favor of her bride Elective Affinities groom, to remind her of what her duty and their relative position advised and commanded indeed, what an un alterable necessity seemed now irrevocably to require; the poor heart gave itself up entirely to its passion."
f000138,1307.800,1339.760,"On one side she was bound inextricably to the bride groom by the world, by her family, and by her own promise; on the other, the ambitious young man made no secret of what he was thinking and planning for himself, conducting himself toward her as no more than a kind but not at all a tender brother, and speaking of his departure as immediately impending; and now it seemed as if her early childish spirit woke up again in her with all its spleen and violence, and was preparing itself in its dis temper, on this higher stage of life, to work more effectively and destructively."
f000139,1339.760,1353.640,"She determined that she would die to punish the once hated, and now so passion ately loved, youth for his want of interest in her; and as she could not possess himself, at least she would wed herself for ever to his imagination, and to his repentance."
f000140,1353.640,1357.520,"Her dead image should cling to him, and he should never be free from it."
f000141,1357.520,1364.080,"He should never cease to reproach him self for not having understood, not examined, not valued her feelings toward him."
f000142,1364.080,1367.760,"This singular insanity accompanied her wherever she went."
f000143,1367.760,1377.200,"She kept it concealed under all sorts of forms; and although people thought her very odd, no one was observant enough or clever enough to discover the real inward reason."
f000144,1377.200,1383.680,"In the meantime, friends, relations, acquaintances had Elective Affinities exhausted themselves in contrivances for pleasure parties."
f000145,1383.680,1387.800,"Scarcely a day passed but something new and unexpected was set on foot."
f000146,1387.800,1394.560,"There was hardly a pretty spot in the country round which had not been decked out and pre pared for the reception of some merry party."
f000147,1394.560,1403.880,"And now our young visitor before departing wished to do his part as well, and invited the young couple, with a small family circle, to an expedition on the water."
f000148,1403.880,1416.560,"They went on board a large, beautiful vessel dressed out in all its colors one of the yachts which have a small saloon and a cabin or two besides, and are intended to carry with them upon the water the comfort and conveniences of land."
f000149,1416.560,1419.760,"They set out upon the broad river with music playing."
f000150,1419.760,1426.360,"The party had collected in the cabin, below deck, during the heat of the day, and were amusing themselves with games."
f000151,1426.360,1435.400,"Their young host, who could never remain with out doing something, had taken charge of the helm, to relieve the old master of the vessel, and the latter had lain down and was fast asleep."
f000152,1435.400,1450.160,"It was a moment when the steerer required all his circumspectness, as the vessel was nearing a spot where two islands narrowed the channel of the river, while shallow banks of shingle stretching off, first on one side and then on the other, made the nav igation difficult and dangerous."
f000153,1450.160,1460.200,"Prudent and sharp sighted as he was, he thought for a moment that it would be better to wake the master; but he felt confident in himself, and he thought he would venture and make straight for the narrows."
f000154,1460.200,1464.840,"At this moment his fair enemy appeared upon deck with a wreath of flowers in her hair."
f000155,1464.840,1467.640,"Elective Affinities 'Take this to remember me by,' she cried out."
f000156,1467.640,1469.920,"She took it off and threw it to the steerer."
f000157,1469.920,1481.200,"Don't disturb me,' he an swered quickly, as he caught the wreath; 'I require all my powers and all my attention now 'You will never be disturbed by me any more she cried; 'you will never see me again.'"
f000158,1481.200,1486.680,"As she spoke, she rushed to the forward part of the vessel, and from thence she sprang into the water."
f000159,1486.680,1490.520,"Voice upon voice called out : 'Save her, save her, she is sinking !'"
f000160,1490.520,1493.200,"He was in the most terrible difficulty."
f000161,1493.200,1499.480,"In the confusion the old shipmaster woke, and tried to catch the helm, which the young man bid him take."
f000162,1499.480,1501.920,"But there was no time to change hands."
f000163,1501.920,1509.680,"The vessel stranded; and at the same moment, flinging off the heaviest of his upper garments, he sprang into the water and swam toward his beautiful enemy."
f000164,1509.680,1518.440,"The water is a friendly element to a man who is at home in it, and who knows how to deal with it; it buoyed him up, and acknowledged the strong swimmer as its master."
f000165,1518.440,1533.720,"He soon overtook the beautiful girl, who had been swept away before him; he caught hold of her, raised her and supported her, and both of them were carried violently down by the current, till the shoals and islands were left far behind, and the river was again open and running smoothly."
f000166,1533.720,1549.600,"He now began to collect himself; they had passed the first immediate danger, in which he had been obliged to act mechanically without time to think; he raised his head as high as he could to look about him; and then swam with all his might to a low bushy point, which ran out conveniently into the stream."
f000167,1549.600,1559.200,"There he brought his fair burden to dry land, Elective Affinities but he could find no signs of life in her; he was in de spair, when he caught sight of a trodden path leading among the bushes."
f000168,1559.200,1565.240,"Again he caught her up in his arms, hurried forward, and presently reached a solitary cottage."
f000169,1565.240,1584.960,"There he found kind, good people a young married couple; the misfortunes and the dangers explained them selves instantly; every remedy he could think of was in stantly applied; a bright fire blazed up: woolen blankets were spread on a bed, counterpane, cloaks, skins, whatever there was at hand which would serve for warmth, were heaped over her as fast as possible."
f000170,1584.960,1589.280,"The desire to save life overpowered, for the present, every other considera tion."
f000171,1589.280,1593.760,"Nothing was left undone to bring back to life the beautiful halftorpid, naked body."
f000172,1593.760,1600.440,"It succeeded; she opened her eyes ! her friend was before her; she threw her heavenly arms about his neck."
f000173,1600.440,1606.120,"In this position she re mained for a time; and then a stream of tears burst out and completed her recovery."
f000174,1606.120,1610.800,"Will you forsake me she cried, 'now when I find you again thus?'"
f000175,1610.800,1615.880,"Never he answered, 'never:' hardly knowing what he said or did."
f000176,1615.880,1620.800,"Only consider yourself she added; 'take care of your self, for your sake and for mine.'"
f000177,1620.800,1635.160,"She now began to collect herself, and for the first time recollected the state in which she was; she could not be ashamed before her darling, before her preserver; but she gladly allowed him to go, that he might take care of him self; for the clothes which he still wore were wet and dripping."
f000178,1635.160,1637.680,"Their young hosts considered what could be done."
f000179,1637.680,1648.800,"Elective Affinities The husband offered the young man, and the wife offered the fair lady, the clothes in which they had been married, which were hanging up in full perfection, and sufficient for a complete suit, inside and out, for two people."
f000180,1648.800,1653.680,"In a short time our pair of adventurers were not only equipped, but in full costume."
f000181,1653.680,1666.000,"They looked most charm ing, gazed at one another, when they met, with admira tion, and then with infinite affection, half laughing at the same time at the quaintness of their appearance, they fell into each other's arms."
f000182,1666.000,1674.120,"The power of youth and the quickening spirit of love in a few moments completely restored them; and there was nothing wanted but music to have set them both off dancing."
f000183,1674.120,1695.960,"To have found themselves brought from the water on dry land, from death into life, from the circle of their families into a wilderness, from despair into rapture, from indifference to affection and to love, all in a moment : the head was not strong enough to bear it; it must either burst, or go distracted; or if so distressing an alternative were to be escaped, the heart must put out all its efforts."
f000184,1695.960,1709.640,"Lost wholly in each other, it was long before they recollected the alarm and anxiety of those who had been left behind; and they themselves, indeed, could not well think, without alarm and anxiety, how they were again to encounter them."
f000185,1709.640,1711.800,"shall we hide ourselves?' said the young man."
f000186,1711.800,1715.320,"We will remain to gether,' she said, as she clung about his neck."
f000187,1715.320,1722.000,"The peasant having heard them say that a party was Elective Affinities aground on the shoal, had hurried down, without stopping to ask another question, to the shore."
f000188,1722.000,1725.360,"When he arrived there, he saw the vessel coming safely down the stream."
f000189,1725.360,1732.200,"After much labor it had been got off; and they were now going on in uncertainty; hoping to find their lost ones again somewhere."
f000190,1732.200,1747.280,"The peasant shouted and made signs to them, and at last caught the attention of those on board; then he ran to a spot where there was a con venient place for landing, and went on signaling and shouting till the vessel's head was turned toward the shore; and what a scene there was for them when they landed!"
f000191,1747.280,1753.160,"The parents of the two betrothed first pressed on the banks; the poor loving bridegroom had almost lost his senses."
f000192,1753.160,1760.400,"They had scarcely learned that their dear children had been saved, when in their strange disguise the latter came forward out of the bushes to meet them."
f000193,1760.400,1763.280,"No one recognized them till they were come quite close."
f000194,1763.280,1765.560,"Whom do I see?' cried the mothers."
f000195,1765.560,1767.880,"What do I see?' cried the fathers."
f000196,1767.880,1771.080,"The preserved ones flung themselves on the ground before them."
f000197,1771.080,1773.840,"Your children they called out; 'a pair.'"
f000198,1773.840,1775.680,"Forgive us !' cried the maiden."
f000199,1775.680,1778.120,"Give us your blessing !' cried the young man."
f000200,1778.120,1782.560,"Give us your bless ing !' they cried both, as all the world stood still in wonder."
f000201,1782.560,1788.200,"Your blessing!' was repeated the third time; and who would have been able to refuse it ?"
f000202,1788.200,1790.200,"End of chapter"