f000282,1579.400,1587.840,"There were no signs of any change when he looked into the actual painting, and yet there was no doubt that the whole expression had altered."
f000283,1587.840,1591.480,"It was not a mere fancy of his own."
f000284,1591.480,1594.840,"The thing was horribly apparent."
f000285,1594.840,1598.880,"He threw himself into a chair, and began to think."
f000286,1598.880,1605.920,"Suddenly there flashed across his mind what he had said in Basil Hallward's studio the day the picture had been finished."
f000287,1605.920,1609.360,"Yes, he remembered it perfectly."
f000288,1609.360,1635.960,"He had uttered a mad wish that he himself might remain young, and the portrait grow old; that his the lines of suffering and thought, and that he might keep all the delicate bloom and loveliness of his then just conscious boyhood."
f000289,1635.960,1639.880,"Surely his wish had not been fulfilled ?"
f000290,1639.880,1642.000,"Such things were impossible."
f000291,1642.000,1645.040,"It seemed monstrous even to think of them."
f000292,1645.040,1651.880,"And, yet, there was the picture before him, with the touch of cruelty in the mouth."
f000293,1651.880,1656.120,"Cruelty I Had he been cruel ?"
f000294,1656.120,1659.800,"It was the girl's fault, not his."
f000295,1659.800,1666.040,"He had dreamed of her as a great artist, had given his love to her because he had thought her great."
f000296,1666.040,1669.440,"Then she had disappointed him."
f000297,1669.440,1671.840,"She had been shallow and unworthy."
f000298,1671.840,1680.360,"And, yet, a feeling of infinite regret came over him, as he thought of her lying at his feet sobbing like a little child."
f000299,1680.360,1684.560,"He remembered with what callousness he had watched her."
f000300,1684.560,1687.680,"Why had he been made like that ?"
f000301,1687.680,1690.680,"Why had such a soul been given to him ?"
f000302,1690.680,1694.040,"But he had suffered also."
f000303,1694.040,1702.680,"During the three terrible hours that the play had lasted, he had lived centuries of pain, seon upon aeon of torture."
f000304,1702.680,1705.880,"His life was well worth hers."
f000305,1705.880,1710.800,"She had marred him for a moment, If he had wounded her for an age."
f000306,1710.800,1715.240,"Besides, women were better suited to bear sorrow than men."
f000307,1715.240,1717.520,"They lived on their emotions."
f000308,1717.520,1719.920,"They only thought of their emotions."
f000309,1719.920,1725.600,"When they took lovers, it was merely to have someone with whom they could have scenes."
f000310,1725.600,1730.680,"Lord Henry had told him that, and Lord Henry knew what women were."
f000311,1730.680,1733.920,"Why should he trouble about Sibyl Vane ?"
f000312,1733.920,1736.000,"She was nothing to him now."
f000313,1736.000,1738.880,"But the picture ?"
f000314,1738.880,1741.320,"What was he to say of that ?"
f000315,1741.320,1745.160,"It held the secret of his life, and told his story."
f000316,1745.160,1748.200,"It had taught him to love his own beauty."
f000317,1748.200,1751.280,"Would it teach him to loathe his own soul ?"
f000318,1751.280,1753.680,"Would he ever look at it again ?"
f000319,1753.680,1762.760,"No; it was merely an illusion wrought on the troubled senses."
f000320,1762.760,1774.160,"The horrible night that he had It was folly to think so."
f000321,1774.160,1781.520,"Yet it was watching him, with its beautiful marred face and its cruel smile."
f000322,1781.520,1785.000,"Its bright hair gleamed in the early sunlight."
f000323,1785.000,1787.240,"Its blue eyes met his own."
f000324,1787.240,1794.480,"A sense of infinite pity, not for himself, but for the painted image of himself, came over him."
f000325,1794.480,1798.640,"It had altered already, and would alter more."
f000326,1798.640,1802.120,"Its gold would wither into grey."
f000327,1802.120,1805.040,"Its red and white roses would die."
f000328,1805.040,1811.400,"For every sin that he committed, a stain would fleck and wreck its fairness."
f000329,1811.400,1813.840,"But he would not sin."
f000330,1813.840,1819.920,"The picture, changed or unchanged, would be to him the visible emblem of conscience."
f000331,1819.920,1822.560,"He would resist temptation."
f000332,1822.560,1835.320,"He would not see Lord Henry any more would not, at any rate, listen to those subtle poisonous theories that in Basil Hallward's garden had first stirred within him the passion for impossible things."
f000333,1835.320,1842.560,"He would go back to Sibyl Vane, make her amends, marry her, try to love her again."
f000334,1842.560,1846.160,"Yes, it was his duty to do so."
f000335,1846.160,1849.440,"She must have suffered more than he had."
f000336,1849.440,1851.480,"Poor child !"
f000337,1851.480,1854.600,"He had been selfish and cruel to her."
f000338,1854.600,1858.760,"The fascination that she had exercised over him would return."
f000339,1858.760,1861.240,"They would be happy together."
f000340,1861.240,1864.960,"His life with her would be beautiful and pure."
f000341,1864.960,1872.520,"He got up from his chair, and drew a large screen right in front of the portrait, shuddering as he glanced at it."
f000342,1872.520,1879.280,"How horrible ! he murmured to himself, and he walked across to the window and opened it."
f000343,1879.280,1884.280,"When he stepped out on to the grass, he drew a deep breath."
f000344,1884.280,1889.600,"The fresh morning air seemed to drive away all his sombre passions."
f000345,1889.600,1891.840,"He thought only of Sibyl."
f000346,1891.840,1895.880,"A faint echo of his love came back to him."
f000347,1895.880,1899.200,"He repeated her name over and over again."
f000348,1899.200,1905.440,"The birds that were singing in the dewdrenched garden seemed to be telling the flowers about her."
f000349,1905.440,1922.080,"end of chapter."