,book,DE_audio,EN_audio,score,DE_transcript,EN_transcript
84,67.frankenstein_de_1211_librivox,00014-frankenstein_87.flac,00014-f000080,0.808103,"Glaube mir, Frankenstein, ich war anfangs nicht böse, in meiner Seele wohnten Güte und Liebe; aber ich bin allein, so furchtbar allein.","Believe me, Frankenstein: I Chapter II was benevolent; my soul glowed with love and humanity: but am I not alone, miserably alone?"
85,67.frankenstein_de_1211_librivox,00014-frankenstein_88.flac,00014-f000080,0.571429,"Du, mein Schöpfer, verabscheust mich, und was habe ich von deinen Mitmenschen zu erwarten, die mir so gar nicht nahestehen?","Believe me, Frankenstein: I Chapter II was benevolent; my soul glowed with love and humanity: but am I not alone, miserably alone?"
86,67.frankenstein_de_1211_librivox,00014-frankenstein_90.flac,00014-f000082,0.8125,Die öden Berghalden und traurigen Gletscher sind meine Zufluchtsorte.,The desert mountains and dreary glaciers are my refuge.
87,67.frankenstein_de_1211_librivox,00014-frankenstein_91.flac,00014-f000082,0.24,Ich habe mich hier so manchen Tag aufgehalten.,The desert mountains and dreary glaciers are my refuge.
88,67.frankenstein_de_1211_librivox,00014-frankenstein_92.flac,00014-f000083,0.583437,"Die Eishöhlen, die allein ich nicht fürchte, sind meine Wohnstätten, und um sie beneidet mich kein menschliches Wesen.","I have wandered here many days; the caves of ice, which I only do not fear, are a dwelling to me, and the only one which man does not grudge."
89,67.frankenstein_de_1211_librivox,00014-frankenstein_93.flac,00014-f000084,0.666667,"Ich segne diesen kalten Himmel, denn er ist gütiger mit mir als deine Mitmenschen.","These bleak skies I hail, for they are kinder to me than your fellowbeings."
90,67.frankenstein_de_1211_librivox,00014-frankenstein_94.flac,00014-f000085,0.60058,"Glaube mir, es wissen ja nicht viele von meiner Existenz; aber wenn das der Fall wäre, dann würden sie sich, wie du, zu meiner Vernichtung entschließen.","If the multitude of mankind knew of my existence, they would do as you do, and arm themselves for my destruction."
91,67.frankenstein_de_1211_librivox,00014-frankenstein_95.flac,00014-f000086,0.4,"Soll ich denn die nicht hassen dürfen, die mich so verabscheuen?",Shall I not then hate them who abhor me?
92,67.frankenstein_de_1211_librivox,00014-frankenstein_96.flac,00014-f000087,1.04,Und ich lasse nicht mit mir spaßen.,I will keep no terms with my enemies.
93,67.frankenstein_de_1211_librivox,00014-frankenstein_97.flac,00014-f000088,0.8804350000000001,Ich bin elend und verflucht und sie sollen es auch werden.,"I am miserable, and they shall share my wretchedness."
94,67.frankenstein_de_1211_librivox,00014-frankenstein_98.flac,00014-f000089,0.8628790000000001,"Du hast es in der Gewalt, mich versöhnlich zu stimmen und die Welt von einem Ungeheuer zu befreien, das nicht nur dich und die Deinen, sondern auch Tausende anderer im Wirbelwinde seines Zornes zermalmen kann.","Yet it is in your power to recompense me, and deliver them from an evil which it only remains for you to make so great, that not only you and your family, but thousands of others, shall be swallowed up in the whirlwinds of its rage."
95,67.frankenstein_de_1211_librivox,00014-frankenstein_99.flac,00014-f000090,0.586364,Habe Mitleid mit mir und verachte meine Bitten nicht.,"Let your compassion be moved, and do not disdain me."
96,67.frankenstein_de_1211_librivox,00014-frankenstein_100.flac,00014-f000091,1.09237,"Höre, was ich dir erzähle, und dann überlaß mich meinem Schicksal oder habe Mitleid mit mir; wie du meinst, daß ich es verdiene.","Listen to my tale: when you have heard that, abandon or commiserate me, as you shall judge that I deserve."
97,67.frankenstein_de_1211_librivox,00014-frankenstein_101.flac,00014-f000092,0.0,Aber höre mich zuerst an.,But hear me.
98,67.frankenstein_de_1211_librivox,00014-frankenstein_102.flac,00014-f000093,0.554082,"Eure Menschengesetze sind roh und blutig, aber dennoch gestatten sie dem Verbrecher, zu seiner Verteidigung das Wort zu ergreifen.","The guilty are allowed, by human laws, bloody as they may be, to speak in their own defence before they are condemned."
99,67.frankenstein_de_1211_librivox,00014-frankenstein_103.flac,00014-f000094,0.9,"Höre mich an, Frankenstein.","Listen to me, Frankenstein."
100,67.frankenstein_de_1211_librivox,00014-frankenstein_104.flac,00014-f000095,0.583333,"Du beschuldigst mich des Mordes und wolltest, ohne daß sich dein Gewissen geregt hätte, dein Geschöpf vernichten.","You accuse me of murder; and yet you would, with a satisfied conscience, destroy your own creature."
101,67.frankenstein_de_1211_librivox,00014-frankenstein_106.flac,00014-f000096,0.272727,Aber ich bitte dich gar nicht um Schonung.,"Oh, praise the eternal justice of man!"
102,67.frankenstein_de_1211_librivox,00014-frankenstein_107.flac,00014-f000097,0.745455,"Höre mich zuerst an, und dann, wenn du kannst und mußt, dann zerstöre das Werk deiner Hände.","Yet I ask you not to spare me: listen to me; and then, if you can, and if you will, destroy the work of your hands."
103,67.frankenstein_de_1211_librivox,00014-frankenstein_108.flac,00014-f000098,0.874533,"Warum erinnerst du mich, erwiderte ich, an die unseligen Ereignisse, die mich heute noch erschauern machen, an die Zeit, da ich dich ins Leben rief?","Why do you call to my remembrance circumstances of which I shudder to reflect, that I have been the miserable origin and author?"
104,67.frankenstein_de_1211_librivox,00014-frankenstein_109.flac,00014-f000099,0.717094,"Verdammt sei der Tag, elender Teufel, da du das erste Mal das Licht sahst.","Cursed be the day, abhorred devil, in which you first saw light!"
105,67.frankenstein_de_1211_librivox,00014-frankenstein_110.flac,00014-f000100,0.582692,"Verflucht seien die Hände, die dich formten!",Cursed although I curse myself be the hands that formed you!
106,67.frankenstein_de_1211_librivox,00014-frankenstein_111.flac,00014-f000100,0.577519,Du hast mich über alle Maßen unglücklich gemacht.,Cursed although I curse myself be the hands that formed you!
107,67.frankenstein_de_1211_librivox,00014-frankenstein_112.flac,00014-f000102,0.478692,"Du hast mir die Kraft genommen zu unterscheiden, was gut und böse ist.","You have left me no power to consider Chapter II whether I am just to you, or not."
108,67.frankenstein_de_1211_librivox,00014-frankenstein_114.flac,00014-f000103,-0.003125,Laß mich deine verhaßte Gestalt nie wieder sehen.,<MERGE> Begone! relieve me from the sight of your detested form.
109,67.frankenstein_de_1211_librivox,00014-frankenstein_115.flac,00014-f000104,1.20872,"So will ich meine Gestalt deinen Blicken entziehen, sagte er und hielt mir seine mächtige Hand vor die Augen, die ich mit Grauen wegschlug.","Thus I relieve thee, my creator, he said, and placed his hated hands before my eyes, which I flung from me with violence; thus I take from thee a sight which you abhor."
110,67.frankenstein_de_1211_librivox,00014-frankenstein_116.flac,00014-f000102,0.983333,So könntest du mich wenigstens hören und Mitleid mit mir haben.,"You have left me no power to consider Chapter II whether I am just to you, or not."
111,67.frankenstein_de_1211_librivox,00014-frankenstein_117.flac,00014-f000106,0.8336899999999999,"Bei meinem besseren Ich beschwöre ich dich, höre meine Worte.","By the virtues that I once possessed, I demand this from you."
112,67.frankenstein_de_1211_librivox,00014-frankenstein_118.flac,00014-f000104,0.729116,"Die Geschichte, die ich zu erzählen habe, ist lang und seltsam, und auf diesem Platze herrscht eine Temperatur, die deinem feinen, zierlichen Leib nicht zusagen dürfte.","Thus I relieve thee, my creator, he said, and placed his hated hands before my eyes, which I flung from me with violence; thus I take from thee a sight which you abhor."
113,67.frankenstein_de_1211_librivox,00014-frankenstein_119.flac,00014-f000105,0.171429,Komm mit mir in meine Hütte auf dem Berge.,"Still thou canst listen to me, and grant me thy compassion."
114,67.frankenstein_de_1211_librivox,00014-frankenstein_120.flac,00014-f000106,0.053571400000000005,Die Sonne steht jetzt noch hoch.,"By the virtues that I once possessed, I demand this from you."
115,67.frankenstein_de_1211_librivox,00014-frankenstein_121.flac,00014-f000107,0.545227,"Ehe sie hinter jenen schneeigen Höhen hinuntergestiegen ist und anderen Ländern leuchtet, hast du meine Geschichte gehört und kannst dich entscheiden.","Hear my tale; it is long and strange, and the temperature of this place is not fitting to your fine sensations; come to the hut upon the mountain."
116,67.frankenstein_de_1211_librivox,00014-frankenstein_122.flac,00014-f000108,0.795871,"An dir liegt es, ob ich dann die Nähe der Menschen fliehe und irgendwo versteckt ein harmloses Dasein führe oder dir und vielen anderen zum Würger werde.","The sun is yet high in the heavens; before it descends to hide itself behind yon snowy precipices, and illuminate another world, you will have heard my story, and can decide."
117,67.frankenstein_de_1211_librivox,00014-frankenstein_123.flac,00014-f000110,0.414286,Unterdessen hatte er den Weg über das Eis eingeschlagen und ich folgte ihm.,"As he said this, he led the way across the ice: I followed."
118,67.frankenstein_de_1211_librivox,00014-frankenstein_124.flac,00014-f000110,1.04464,"Mein Herz war zu voll und ich fand keine Worte, um ihm irgend etwas zu erwidern.","As he said this, he led the way across the ice: I followed."
119,67.frankenstein_de_1211_librivox,00014-frankenstein_125.flac,00014-f000111,0.4235020000000001,"Aber während ich ging, erwog ich die verschiedenen Umstände, deren er Erwähnung getan, und beschloß, zum mindesten seine Geschichte anzuhören.","My heart was full, and I did not answer him; but, as I pro ceeded, I weighed the various arguments that he had used, and determined at least to listen to his tale."
120,67.frankenstein_de_1211_librivox,00014-frankenstein_126.flac,00014-f000112,0.571429,"Hauptsächlich war es Neugierde, die mir diesen Entschluß eingab, aber auch ein schwaches Gefühl des Mitleids mengte sich hinein.","I was partly urged by curiosity, and compassion confirmed my resolution."
121,67.frankenstein_de_1211_librivox,00014-frankenstein_127.flac,00014-f000113,0.828883,"Ich hatte ihn bisher für den Mörder meines Bruders gehalten und war begierig, aus seinen Worten eine Bestätigung oder Widerlegung dieser Ansicht zu vernehmen.","I had hitherto supposed him to be the murderer of my brother, and I eagerly sought a confirmation or denial of this opinion."
122,67.frankenstein_de_1211_librivox,00014-frankenstein_128.flac,00014-f000114,1.10545,"Ich empfand auch das erste Mal, daß ein Schöpfer seinem Werke gegenüber Verpflichtungen habe und daß ich versuchen müsse, dem Armen etwas Glück zu bescheren.","For the first time, also, I felt what the duties of a creator towards his creature were, and that I ought to render him happy before I complained of his wickedness."
123,67.frankenstein_de_1211_librivox,00014-frankenstein_129.flac,00014-f000115,0.561905,All diese Erwägungen machten mich seinen Bitten geneigter.,These motives urged me to comply with his demand.
124,67.frankenstein_de_1211_librivox,00014-frankenstein_130.flac,00014-f000115,0.564286,Wir passierten das Eis und stiegen die Felswand hinan.,These motives urged me to comply with his demand.
