,book,DE_audio,EN_audio,score,DE_transcript,EN_transcript
0,108.wahlverwandtschaften_0902_librivox_64kb_mp3,1.18_1.flac,00018-f000003,0.594779,"Doch schien es ihm rätlich, erst eine Weile zu zaudern; denn er wußte nur zu wohl, daß es schwerer sei, gebildeten Menschen bei sittlichen Verworrenheiten zu Hülfe zu kommen als ungebildeten. Er überließ sie deshalb eine Zeitlang sich selbst; allein zuletzt konnte er es nicht mehr aushalten und eilte, Eduarden aufzusuchen, dem er schon auf die Spur gekommen war.","He thought it advisable, however, to wait first a little while; know ing too well, as he did, that it was more difficult to come to the aid of cultivated persons in their moral perplex ities than of the uncultivated."
1,108.wahlverwandtschaften_0902_librivox_64kb_mp3,1.18_2.flac,00018-f000005,0.489623,"Sein Weg führte ihn zu einem angenehmen Tal, dessen anmutig grünen, baumreichen Wiesengrund die Wasserfülle eines immer lebendigen Baches bald durchschlängelte, bald durchrauschte.","His road led him to a pleasant, pretty valley, with a range of green, sweetly wooded meadows, down the centre of which ran a neverfailing stream, sometimes winding slowly along, then tumbling and rushing among rocks and stones."
2,108.wahlverwandtschaften_0902_librivox_64kb_mp3,1.18_3.flac,00018-f000006,0.527066,Auf den sanften Anhöhen zogen sich fruchtbare Felder und wohlbestandene Obstpflanzungen hin.,"The hills sloped gently up on either side, covered with rich cornfields and wellkept orchards."
3,108.wahlverwandtschaften_0902_librivox_64kb_mp3,1.18_5.flac,00018-f000009,0.775,"Ein wohlerhaltenes Vorwerk mit einem reinlichen, bescheidenen Wohnhause, von Gärten umgeben, fiel ihm endlich in die Augen.","At last a neatly kept farm, with a clean, modest dwell Elective Affinities inghouse, situated in the middle of a garden, fell under his eye."
4,108.wahlverwandtschaften_0902_librivox_64kb_mp3,1.18_6.flac,00018-f000010,0.795455,"Er vermutete, hier sei Eduards gegenwärtiger Aufenthalt, und er irrte nicht.",He conjectured that this was Edward's pres ent abodej and he was not mistaken.
5,108.wahlverwandtschaften_0902_librivox_64kb_mp3,1.18_7.flac,00018-f000011,0.765868,"Von diesem einsamen Freunde können wir so viel sagen, daß er sich im stillen dem Gefühl seiner Leidenschaft ganz überließ und dabei mancherlei Plane sich ausdachte, mancherlei Hoffnungen nährte.","Of this our friend in his solitude we have only thus much to say that in his seclusion he was resigning him self utterly to the feeling of his passion, thinking out plan after plan, and feeding himself with innumerable hopes."
6,108.wahlverwandtschaften_0902_librivox_64kb_mp3,1.18_8.flac,00018-f000012,0.7433770000000001,"Er konnte sich nicht leugnen, daß er Ottilien hier zu sehen wünsche, daß er wünsche, sie hieher zu führen, zu locken, und was er sich sonst noch Erlaubtes und Unerlaubtes zu denken nicht verwehrte.","He could not deny that he longed to see Ottilie there; that he would like to carry her off there, to tempt her there; and whatever else putting, as he now did, no check upon his thoughts pleased to suggest itself, whether permitted or unpermitted."
7,108.wahlverwandtschaften_0902_librivox_64kb_mp3,1.18_9.flac,00018-f000013,0.260656,Dann schwankte seine Einbildungskraft in allen Möglichkeiten herum.,"Then his imagina tion wandered up and down, picturing every sort of pos sibility."
8,108.wahlverwandtschaften_0902_librivox_64kb_mp3,1.18_10.flac,00018-f000014,0.26363600000000004,"Sollte er sie hier nicht besitzen, nicht rechtmäßig besitzen können, so wollte er ihr den Besitz des Gutes zueignen.","If he could not have her there, if he could not lawfully possess her, he would secure to her the pos session of the property for her own."
9,108.wahlverwandtschaften_0902_librivox_64kb_mp3,1.18_11.flac,00018-f000015,1.14016,"Hier sollte sie still für sich, unabhängig leben; sie sollte glücklich sein und, wenn ihn eine selbstquälerische Einbildungskraft noch weiter führte, vielleicht mit einem andern glücklich sein.","There she should live for herself, silently, independently; she should be happy in that spot sometimes his selftorturing mood would lead him further be happy in it, perhaps, with another."
10,108.wahlverwandtschaften_0902_librivox_64kb_mp3,1.18_12.flac,00018-f000016,1.20571,"So verflossen ihm seine Tage in einem ewigen Schwanken zwischen Hoffnung und Schmerz, zwischen Tränen und Heiterkeit, zwischen Vorsätzen, Vorbereitungen und Verzweiflung.","So days flowed away in increasing oscillation between hope and suffering, between tears and happiness; be tween purposes, preparations, and despair."
11,108.wahlverwandtschaften_0902_librivox_64kb_mp3,1.18_13.flac,00018-f000017,0.19011,Der Anblick Mittlers überraschte ihn nicht.,"The sight of Mittler did not surprise him; he had long expected that he would come; and now that he did, he was partly welcome to him."
12,108.wahlverwandtschaften_0902_librivox_64kb_mp3,1.18_14.flac,00018-f000018,0.99,"Er hatte dessen Ankunft längst erwartet, und so war er ihm auch halb willkommen.",He believed that he had been sent by Charlotte.
13,108.wahlverwandtschaften_0902_librivox_64kb_mp3,1.18_15.flac,00018-f000019,0.830102,"Glaubte er ihn von Charlotten gesendet, so hatte er sich schon auf allerlei Entschuldigungen und Verzögerungen und sodann auf entscheidendere Vorschläge bereitet; hoffte er nun aber von Ottilien wieder etwas zu vernehmen, so war ihm Mittler so lieb als ein himmlischer Bote.","He had prepared himself with all manner of excuses and delays; and if these would not serve, with decided refusals; or else, perhaps, he might hope to learn some Elective Affinities thing of Ottilie and then he would be dear to him as a messenger from heaven."
14,108.wahlverwandtschaften_0902_librivox_64kb_mp3,1.18_16.flac,00018-f000020,0.564846,"Verdrießlich daher und verstimmt war Eduard, als er vernahm, Mittler komme nicht von dorther, sondern aus eignem Antriebe.","Not a little vexed and annoyed was Edward, therefore, when he understood that Mittler had not come from the castle at all, but of his own free accord."
15,108.wahlverwandtschaften_0902_librivox_64kb_mp3,1.18_17.flac,00018-f000021,0.727667,"Sein Herz verschloß sich, und das Gespräch wollte sich anfangs nicht einleiten.","His heart closed up, and at first the conversation would not open itself."
16,108.wahlverwandtschaften_0902_librivox_64kb_mp3,1.18_19.flac,00018-f000024,1.07579,"Als er hiernach auf eine freundliche Weise Eduarden wegen seines einsamen Lebens tadelte, erwiderte dieser: O, ich wüßte nicht, wie ich meine Zeit angenehmer zubringen sollte!","He had been finding fault in a goodnatured way with Edward, for burying himself in that lonely place, upon which Edward replied : I do not know how I could spend my time more agreeably."
17,108.wahlverwandtschaften_0902_librivox_64kb_mp3,1.18_20.flac,00018-f000025,1.11166,"Immer bin ich mit ihr beschäftigt, immer in ihrer Nähe.",I am always occupied with her; I am always close to her.
18,108.wahlverwandtschaften_0902_librivox_64kb_mp3,1.18_21.flac,00018-f000026,0.8984,"Ich habe den unschätzbaren Vorteil, mir denken zu können, wo sich Ottilie befindet, wo sie geht, wo sie steht, wo sie ausruht.","I have the inestimable comfort of being able to think where Ottilie is at each moment where she is going, where she is standing, where she is repos ing."
19,108.wahlverwandtschaften_0902_librivox_64kb_mp3,1.18_22.flac,00018-f000027,0.926383,"Ich sehe sie vor mir tun und handeln wie gewöhnlich, schaffen und vornehmen, freilich immer das, was mir am meisten schmeichelt.",I see her moving and acting before me as usual; ever doing or designing something which is to give me pleasure.
20,108.wahlverwandtschaften_0902_librivox_64kb_mp3,1.18_23.flac,00018-f000028,1.07368,Dabei bleibt es aber nicht; denn wie kann ich fern von ihr glücklich sein!,But this will not always answer; for how can I be happy away from her ?
21,108.wahlverwandtschaften_0902_librivox_64kb_mp3,1.18_24.flac,00018-f000029,0.459769,"Nun arbeitet meine Phantasie durch, was Ottilie tun sollte, sich mir zu nähern.","And then my fancy begins to work; I think what Ottilie should do to come to me; I write sweet, loving letters in her name to myself, and then I answer them, and keep the sheets together."
22,108.wahlverwandtschaften_0902_librivox_64kb_mp3,1.18_25.flac,00018-f000029,0.459769,"Ich schreibe süße, zutrauliche Briefe in ihrem Namen an mich, ich antworte ihr und verwahre die Blätter zusammen.","<MERGE> And then my fancy begins to work; I think what Ottilie should do to come to me; I write sweet, loving letters in her name to myself, and then I answer them, and keep the sheets together."
23,108.wahlverwandtschaften_0902_librivox_64kb_mp3,1.18_26.flac,00018-f000030,0.8910450000000001,"Ich habe versprochen, keinen Schritt gegen sie zu tun, und das will ich halten.",I have promised that I will take no steps to seek her; an'd that promise I will keep.
24,108.wahlverwandtschaften_0902_librivox_64kb_mp3,1.18_27.flac,00018-f000031,0.91,"Aber was bindet sie, daß sie sich nicht zu mir wendet?",But what binds her that she Elective Affinities should make no advances to me ?
25,108.wahlverwandtschaften_0902_librivox_64kb_mp3,1.18_28.flac,00018-f000032,0.383793,"Hat etwa Charlotte die Grausamkeit gehabt, Versprechen und Schwur von ihr zu fordern, daß sie mir nicht schreiben, keine Nachricht von sich geben wolle?","Has Charlotte had the barbarity to exact a promise, to exact an oath from her, not to write to me, not to send me a word, a hint, about herself?"
26,108.wahlverwandtschaften_0902_librivox_64kb_mp3,1.18_29.flac,00018-f000034,0.611905,"Es ist natürlich, es ist wahrscheinlich, und doch finde ich es unerhört, unerträglich.","It is only natural; and yet to me it is monstrous, it is horrible."
27,108.wahlverwandtschaften_0902_librivox_64kb_mp3,1.18_30.flac,00018-f000035,0.974359,"Wenn sie mich liebt, wie ich glaube, wie ich weiß, warum entschließt sie sich nicht, warum wagt sie es nicht, zu fliehen und sich in meine Arme zu werfen?","If she loves me as I think, as I know that she does why does she not resolve, why does she not venture to fly to me, and throw herself into my arms ?"
28,108.wahlverwandtschaften_0902_librivox_64kb_mp3,1.18_31.flac,00018-f000036,0.593023,"Sie sollte das, denke ich manchmal, sie könnte das.",I often think she ought to do it; and she could do it.
29,108.wahlverwandtschaften_0902_librivox_64kb_mp3,1.18_32.flac,00018-f000037,0.95401,"Wenn sich etwas auf dem Vorsaale regt, sehe ich gegen die Türe.","If I ever hear a noise in the hall, I look toward the door."
30,108.wahlverwandtschaften_0902_librivox_64kb_mp3,1.18_33.flac,00018-f000038,0.658784,"Sie soll hereintreten! denk ich, hoff ich.",It must be she she is coming I look up to see her.
31,108.wahlverwandtschaften_0902_librivox_64kb_mp3,1.18_34.flac,00018-f000039,0.619608,"Ach! und da das Mögliche unmöglich ist, bilde ich mir ein, das Unmögliche müsse möglich werden.","Alas! because the possible is im possible, I let myself imagine that the impossible must become possible."
32,108.wahlverwandtschaften_0902_librivox_64kb_mp3,1.18_36.flac,00018-f000042,0.257143,Eine einzige Freude bleibt mir noch.,Only one pleasure remains to me.
33,108.wahlverwandtschaften_0902_librivox_64kb_mp3,1.18_37.flac,00018-f000043,0.7172850000000001,"Da ich ihr nahe war, träumte ich nie von ihr; jetzt aber, in der Ferne, sind wir im Traume zusammen, und sonderbar genug: seit ich andre liebenswürdige Personen hier in der Nachbarschaft kennengelernt, jetzt erst erscheint mir ihr Bild im Traum, als wenn sie mir sagen wollte: Siehe nur hin und her! du findest doch nichts Schöneres und Lieberes als mich.","When I was with her I never dreamt of her; now when I am far away, and, oddly enough, since I have made the acquaintance of other attractive persons in this neigh borhood, for the first time, her figure appears to me in my dreams, as if she would say to me, 'Look on them, and on me."
34,108.wahlverwandtschaften_0902_librivox_64kb_mp3,1.18_38.flac,00018-f000044,0.54482,Und so mischt sich ihr Bild in jeden meiner Träume.,"You will find none more beautiful, more lovely than I.'"
35,108.wahlverwandtschaften_0902_librivox_64kb_mp3,1.18_39.flac,00018-f000045,0.645455,"Alles, was mir mit ihr begegnet, schiebt sich durch und übereinander.",And so she is present in every dream I have.
36,108.wahlverwandtschaften_0902_librivox_64kb_mp3,1.18_41.flac,00018-f000048,0.25866500000000003,Auch nicht ohne Schmerz sind diese wonnevollen Gaukeleien der Phantasie.,"There is her hand, and there is mine; there is her name, and there is mine; and they move one Elective Affinities into the other, and seem to devour each other."
37,108.wahlverwandtschaften_0902_librivox_64kb_mp3,1.18_42.flac,00018-f000049,0.783871,"Manchmal tut sie etwas, das die reine Idee beleidigt, die ich von ihr habe, dann fühl ich erst, wie sehr ich sie liebe, indem ich über alle Beschreibung geängstet bin.","Some times she does something which injures the pure idea which I have of her; and then I feel how intensely I love her, by the indescribable anguish which it causes me."
38,108.wahlverwandtschaften_0902_librivox_64kb_mp3,1.18_43.flac,00018-f000050,0.4774850000000001,"Manchmal neckt sie mich ganz gegen ihre Art und quält mich; aber sogleich verändert sich ihr Bild, ihr schönes, rundes, himmlisches Gesichtchen verlängert sich: es ist eine andre.","Again, unlike herself, she will rally and vex me; and then at once the figure changes her sweet, round, heav enly face draws out; it is not she, it is another; but I lie vexed, dissatisfied, and wretched."
39,108.wahlverwandtschaften_0902_librivox_64kb_mp3,1.18_44.flac,00018-f000051,0.915447,"Aber ich bin doch gequält, unbefriedigt und zerrüttet.","Laugh not, dear Mit tler, or laugh on as you will."
40,108.wahlverwandtschaften_0902_librivox_64kb_mp3,1.18_45.flac,00018-f000052,0.403704,"Lächeln Sie nicht, lieber Mittler, oder lächeln Sie auch! ich schäme mich nicht dieser Anhänglichkeit, dieser, wenn Sie wollen, törigen, rasenden Neigung.","I am not ashamed of this attachment, of this if you please to call it so foolish, frantic passion."
41,108.wahlverwandtschaften_0902_librivox_64kb_mp3,1.18_46.flac,00018-f000055,0.608571,"Nein, ich habe noch nie geliebt; jetzt erfahre ich erst, was das heißt.","Till now, what I have called life was nothing but its prelude amuse ment, sport to kill the time with."
42,108.wahlverwandtschaften_0902_librivox_64kb_mp3,1.18_47.flac,00018-f000055,0.642857,"Bisher war alles in meinem Leben nur Vorspiel, nur Hinhalten, nur Zeitvertreib, nur Zeitverderb, bis ich sie kennenlernte, bis ich sie liebte und ganz und eigentlich liebte.","Till now, what I have called life was nothing but its prelude amuse ment, sport to kill the time with."
43,108.wahlverwandtschaften_0902_librivox_64kb_mp3,1.18_48.flac,00018-f000057,0.84375,"Man hat mir nicht gerade ins Gesicht, aber doch wohl im Rücken den Vorwurf gemacht: ich pfusche, ich stümpere nur in den meisten Dingen.","People have often said of me, not to my face, but be hind my back, that in most things I was but a botcher and a bungler."
44,108.wahlverwandtschaften_0902_librivox_64kb_mp3,1.18_49.flac,00018-f000058,1.215,"Es mag sein; aber ich hatte das noch nicht gefunden, worin ich mich als Meister zeigen kann.",It may be so; for I had not then found in what I could show myself a master.
45,108.wahlverwandtschaften_0902_librivox_64kb_mp3,1.18_50.flac,00018-f000059,1.05,"Ich will den sehen, der mich im Talent des Liebens übertrifft.",I should like to see the man who outdoes me in the talent of love.
46,108.wahlverwandtschaften_0902_librivox_64kb_mp3,1.18_52.flac,00018-f000062,0.737627,"Mittler, der sein rasches Naturell, seinen unerbittlichen Verstand um so weniger verleugnen konnte, als er sich durch diesen schmerzlichen Ausbruch der Leidenschaft Eduards weit von dem Ziel seiner Reise verschlagen sah, äußerte aufrichtig und derb seine Mißbilligung.","But in doing so every feature of his strange condition had been brought out so clearly before his eyes that, overpowered by the pain of the struggle, he burst into tears, which flowed all the more freely as his heart had been made weak by telling it all."
47,108.wahlverwandtschaften_0902_librivox_64kb_mp3,1.18_54.flac,00018-f000067,0.8,"Aufgeregt, durchdrungen von den peinlichsten Gefühlen, wie Eduard war, mußten ihm diese Worte hohl und nichtig vorkommen.","Stirred and penetrated as Edward was with the bitter est feelings, words like these could but have a hollow, worthless sound."
48,108.wahlverwandtschaften_0902_librivox_64kb_mp3,1.18_55.flac,00018-f000068,0.3936,"Der Glückliche, der Behagliche hat gut reden, fuhr Eduard auf; aber schämen würde er sich, wenn er einsähe, wie unerträglich er dem Leidenden wird.","It is well, he cried, for the man who is happy, who has all that he desires, to talk; but he would be ashamed of it if he could see how intolerable it was to the sufferer."
49,108.wahlverwandtschaften_0902_librivox_64kb_mp3,1.18_56.flac,00018-f000067,0.265263,"Eine unendliche Geduld soll es geben, einen unendlichen Schmerz will der starre Behagliche nicht anerkennen.","Stirred and penetrated as Edward was with the bitter est feelings, words like these could but have a hollow, worthless sound."
50,108.wahlverwandtschaften_0902_librivox_64kb_mp3,1.18_57.flac,00018-f000070,0.8508120000000001,"Es gibt Fälle, ja, es gibt deren! wo jeder Trost niederträchtig und Verzweiflung Pflicht ist.","There are cases, he continued, yes, there are, where comfort is a lie, and despair is a duty."
51,108.wahlverwandtschaften_0902_librivox_64kb_mp3,1.18_58.flac,00018-f000069,0.4123020000000001,"Verschmäht doch ein edler Grieche, der auch Helden zu schildern weiß, keineswegs, die seinigen bei schmerzlichem Drange weinen zu lassen.","Nothing short of an infinite endurance would be enough, and easy and contented as he was, what could he know of an infinite agony?"
52,108.wahlverwandtschaften_0902_librivox_64kb_mp3,1.18_59.flac,00018-f000070,-0.0638889,Selbst im Sprüchwort sagt er:,"There are cases, he continued, yes, there are, where comfort is a lie, and despair is a duty."
53,108.wahlverwandtschaften_0902_librivox_64kb_mp3,1.18_60.flac,00018-f000070,-0.0638889,Tränenreiche Männer sind gut.,"<MERGE> There are cases, he continued, yes, there are, where comfort is a lie, and despair is a duty."
54,108.wahlverwandtschaften_0902_librivox_64kb_mp3,1.18_61.flac,00018-f000073,0.289091,"Verlasse mich jeder, der trocknen Herzens, trockner Augen ist!","Curses on the happy, to whom the wretched serve but for a spectacle."
55,108.wahlverwandtschaften_0902_librivox_64kb_mp3,1.18_62.flac,00018-f000074,0.250769,"Ich verwünsche die Glücklichen, denen der Unglückliche nur zum Spektakel dienen soll.","When body and soul are torn in pieces with agony, they are to bear it yes, to be noble and bear it, if they are to be allowed to go off Elective Affinities the scene with applause."
56,108.wahlverwandtschaften_0902_librivox_64kb_mp3,1.18_63.flac,00018-f000075,0.356092,"Er soll sich in der grausamsten Lage körperlicher und geistiger Bedrängnis noch edel gebärden, um ihren Beifall zu erhalten, und, damit sie ihm beim Verscheiden noch applaudieren, wie ein Gladiator mit Anstand vor ihren Augen umkommen.","Like the gladiators, they must die gracefully before the eyes of the multitude."
57,108.wahlverwandtschaften_0902_librivox_64kb_mp3,1.18_64.flac,00018-f000076,0.8777780000000001,"Lieber Mittler, ich danke Ihnen für Ihren Besuch; aber Sie erzeigten mir eine große Liebe, wenn Sie sich im Garten, in der Gegend umsähen.","My dear Mittler, I thank you for your visit; but really you would oblige me much if you would go out and look about you in the garden."
58,108.wahlverwandtschaften_0902_librivox_64kb_mp3,1.18_65.flac,00018-f000077,0.7588239999999999,Wir kommen wieder zusammen.,We will meet again.
59,108.wahlverwandtschaften_0902_librivox_64kb_mp3,1.18_66.flac,00018-f000078,0.6124029999999999,Ich suche gefaßter und Ihnen ähnlicher zu werden.,"I will try to compose myself, and become more like you."
60,108.wahlverwandtschaften_0902_librivox_64kb_mp3,1.18_67.flac,00018-f000079,0.476471,"Mittler mochte lieber einlenken als die Unterhaltung abbrechen, die er so leicht nicht wieder anknüpfen konnte.","Mittler was unwilling to let a conversation drop which it might be difficult to begin again, and still persevered."
61,108.wahlverwandtschaften_0902_librivox_64kb_mp3,1.18_68.flac,00018-f000080,0.630272,"Auch Eduarden war es ganz gemäß, das Gespräch weiter fortzusetzen, das ohnehin zu seinem Ziele abzulaufen strebte.","Edward, too, was quite ready to go on with it; besides that of itself it was tending toward the issue which he desired."
62,108.wahlverwandtschaften_0902_librivox_64kb_mp3,1.18_70.flac,00018-f000084,0.5995729999999999,"Bewirken Sie, bester Mann, eine Scheidung, die so notwendig, die schon geschehen ist schaffen Sie mir Charlottens Einwilligung!","Do you, my best friend, bring about the separa tion which must take place, which, in fact, is already made; gain Charlotte's consent for me."
63,108.wahlverwandtschaften_0902_librivox_64kb_mp3,1.18_71.flac,00018-f000085,0.621739,"Ich will nicht weiter ausführen, warum ich glaube, daß sie zu erlangen sein wird.",I will not enter upon the reasons why I believe there will be the less diffi culty in prevailing upon her.
64,108.wahlverwandtschaften_0902_librivox_64kb_mp3,1.18_73.flac,00018-f000088,0.2625,Eduard fuhr fort:,Mittler hesitated.
65,108.wahlverwandtschaften_0902_librivox_64kb_mp3,1.18_74.flac,00018-f000089,0.8959999999999999,"Mein Schicksal und Ottiliens ist nicht zu trennen, und wir werden nicht zugrunde gehen.","Edward continued: My fate and Ottilie's can not be divided, and shall not be shipwrecked."
66,108.wahlverwandtschaften_0902_librivox_64kb_mp3,1.18_75.flac,00018-f000090,-0.09,Sehen Sie dieses Glas!,Look at this glass; our initials are en graved upon it.
67,108.wahlverwandtschaften_0902_librivox_64kb_mp3,1.18_76.flac,00018-f000091,0.146154,Unsere Namenszüge sind dareingeschnitten.,"A gay reveler flung it into the air, that no one should drink of it more."
68,108.wahlverwandtschaften_0902_librivox_64kb_mp3,1.18_77.flac,00018-f000092,0.181988,"Ein fröhlich Jubelnder warf es in die Luft; niemand sollte mehr daraus trinken, auf dem felsigen Boden sollte es zerschellen; aber es ward aufgefangen.",It was to fall on the rock and be dashed to pieces; but it did not fall; it was caught.
69,108.wahlverwandtschaften_0902_librivox_64kb_mp3,1.18_78.flac,00018-f000093,0.6695949999999999,"Um hohen Preis habe ich es wieder eingehandelt, und ich trinke nun täglich daraus, um mich täglich zu überzeugen, daß alle Verhältnisse unzerstörlich sind, die das Schicksal beschlossen hat.","At a high price I bought it back, and now I drink Elective Affinities out of it daily to convince myself that the connection between us can not be broken; that destiny has decided."
70,108.wahlverwandtschaften_0902_librivox_64kb_mp3,1.18_79.flac,00018-f000094,0.6642859999999999,"O wehe mir, rief Mittler, was muß ich nicht mit meinen Freunden für Geduld haben!","Alas, alas! cried Mittler, what must I not endure with my friends ?"
71,108.wahlverwandtschaften_0902_librivox_64kb_mp3,1.18_80.flac,00018-f000095,0.442857,"Nun begegnet mir noch gar der Aberglaube, der mir als das Schädlichste, was bei den Menschen einkehren kann, verhaßt bleibt.","Here comes superstition, which of all things I hate the worst the most mischievous and ac cursed of all the plagues of mankind."
72,108.wahlverwandtschaften_0902_librivox_64kb_mp3,1.18_81.flac,00018-f000096,0.82926,Wir spielen mit Voraussagungen und Träumen und machen dadurch das alltägliche Leben bedeutend.,"We trifle with prophecies, with forebodings, and dreams, and give a seriousness to our everyday life with them; but when the seriousness of life itself begins to show, when everything around us is heaving and rolling, then come in these spectres to make the storm more terrible."
73,108.wahlverwandtschaften_0902_librivox_64kb_mp3,1.18_83.flac,00018-f000099,0.75071,"Lassen Sie in dieser Ungewißheit des Lebens, rief Eduard, zwischen diesem Hoffen und Bangen dem bedürftigen Herzen doch nur eine Art von Leitstern, nach welchem es hinblicke, wenn es auch nicht darnach steuern kann.","Yes, I might leave it; and it would be very well, re plied Mittler, if there were but one consequence to ex pect; but I have always found that nobody will attend to symptoms of warning."
74,108.wahlverwandtschaften_0902_librivox_64kb_mp3,1.18_84.flac,00018-f000100,0.247074,"Ich ließe mirs wohl gefallen, versetzte Mittler, wenn dabei nur einige Konsequenz zu hoffen wäre, aber ich habe immer gefunden: auf die warnenden Symptome achtet kein Mensch, auf die schmeichelnden und versprechenden allein ist die Aufmerksamkeit gerichtet und der Glaube für sie ganz allein lebendig.",Man cares for nothing except what flatters him and promises him fair; and his faith is alive exclusively for the sunny side.
75,108.wahlverwandtschaften_0902_librivox_64kb_mp3,1.18_85.flac,00018-f000101,0.588889,"Da sich nun Mittler sogar in die dunklen Regionen geführt sah, in denen er sich immer unbehaglicher fühlte, je länger er darin verweilte, so nahm er den dringenden Wunsch Eduards, der ihn zu Charlotten gehen hieß, etwas williger auf.","Mittler, finding himself carried off into the shadowy regions, in which the longer he remained in them, the more uncomfortable he always felt, was the more ready to assent to Edward's eager wish that he should go to Charlotte."
