,book,DE_audio,EN_audio,score,DE_transcript,EN_transcript
68,108.wahlverwandtschaften_0902_librivox_64kb_mp3,1.17_78.flac,00017-f000089,0.24491,Doch konnte sie sich von diesen Rabatten und Beeten nicht trennen.,"<MERGE> Over and over again, whenever the faithful old servant saw Ottilie, he asked when his master might be expected home; and when Ottilie had nothing to tell him, he would look vexed, and let her see in his manner that he thought she did not care to tell him : the sense of uncertainty which was thus forced upon her became painful beyond measure, and yet she could never be absent from these beds and borders."
69,108.wahlverwandtschaften_0902_librivox_64kb_mp3,1.17_79.flac,00017-f000091,0.494039,"Was sie zusammen zum Teil gesäet, alles gepflanzt hatten, stand nun im völligen Flor; kaum bedurfte es noch einer Pflege, außer daß Nanny immer zum Gießen bereit war.","Into real open, hearty understanding with Charlotte, there was no more a chance of her being able to return; for, indeed, the position of these two ladies was very dif ferent."
70,108.wahlverwandtschaften_0902_librivox_64kb_mp3,1.17_80.flac,00017-f000092,0.639706,"Mit welchen Empfindungen betrachtete Ottilie die späteren Blumen, die sich erst anzeigten, deren Glanz und Fülle dereinst an Eduards Geburtstag, dessen Feier sie sich manchmal versprach, prangen, ihre Neigung und Dankbarkeit ausdrücken sollten!","If things could remain in their old state if it were possible that they could return again into the smooth, even way of calm, ordered life, Charlotte gained every thing; she gained happiness for the present, and a happy future opened before her."
71,108.wahlverwandtschaften_0902_librivox_64kb_mp3,1.17_81.flac,00017-f000091,0.10831500000000001,"Doch war die Hoffnung, dieses Fest zu sehen, nicht immer gleich lebendig.","Into real open, hearty understanding with Charlotte, there was no more a chance of her being able to return; for, indeed, the position of these two ladies was very dif ferent."
72,108.wahlverwandtschaften_0902_librivox_64kb_mp3,1.17_82.flac,00017-f000091,0.10831500000000001,Zweifel und Sorgen umflüsterten stets die Seele des guten Mädchens.,"<MERGE> Into real open, hearty understanding with Charlotte, there was no more a chance of her being able to return; for, indeed, the position of these two ladies was very dif ferent."
73,108.wahlverwandtschaften_0902_librivox_64kb_mp3,1.17_83.flac,00017-f000092,0.209536,"Zu einer eigentlichen, offnen Übereinstimmung mit Charlotten konnte es auch wohl nicht wieder gebracht werden.","If things could remain in their old state if it were possible that they could return again into the smooth, even way of calm, ordered life, Charlotte gained every thing; she gained happiness for the present, and a happy future opened before her."
74,108.wahlverwandtschaften_0902_librivox_64kb_mp3,1.17_84.flac,00017-f000092,0.209536,Denn freilich war der Zustand beider Frauen sehr verschieden.,"<MERGE> If things could remain in their old state if it were possible that they could return again into the smooth, even way of calm, ordered life, Charlotte gained every thing; she gained happiness for the present, and a happy future opened before her."
75,108.wahlverwandtschaften_0902_librivox_64kb_mp3,1.17_85.flac,00017-f000093,0.440594,"Wenn alles beim alten blieb, wenn man in das Gleis des gesetzmäßigen Lebens zurückkehrte, gewann Charlotte an gegenwärtigem Glück, und eine frohe Aussicht in die Zukunft öffnete sich ihr; Ottilie hingegen verlor alles, man kann wohl sagen alles; denn sie hatte zuerst Leben und Freude in Eduard gefunden, und in dem gegenwärtigen Zustande fühlte sie eine unendliche Leere, wovon sie früher kaum etwas geahnet hatte. Denn ein Herz, das sucht, fühlt wohl, daß ihm etwas mangle; ein Herz, das verloren hat, fühlt, daß es entbehre.","On the other hand, for Ot tilie all was lost one may say, all; for she had first found in Edward what life and happiness meant; and, in her present position she felt an infinite and dreary chasm of which before she could have formed no conception."
76,108.wahlverwandtschaften_0902_librivox_64kb_mp3,1.17_86.flac,00017-f000094,0.677713,"Sehnsucht verwandelt sich in Unmut und Ungeduld, und ein weibliches Gemüt, zum Erwarten und Abwarten gewöhnt, möchte nun aus seinem Kreise herausschreiten, tätig werden, unternehmen und auch etwas für sein Glück tun.","A heart which seeks feels well that it wants something; a heart which has lost feels that something is gone its yearning and its longing change into uneasy impatience and a woman's spirit, which is accustomed to waiting and to enduring, must now pass out from its proper sphere; become active, and attempt and do something to make its own hapoiness."
77,108.wahlverwandtschaften_0902_librivox_64kb_mp3,1.17_87.flac,00017-f000095,0.212418,Ottilie hatte Eduarden nicht entsagt.,"Elective Affinities Ottilie had not given up Edward how could she? although Charlotte, wisely enough, in spite of her convic tion to the contrary, assumed it as a thing of course, and resolutely took it as decided that a quiet rational regard was possible between her husband and Ottilie."
78,108.wahlverwandtschaften_0902_librivox_64kb_mp3,1.17_88.flac,00017-f000095,0.212418,"Wie konnte sie es auch, obgleich Charlotte klug genug, gegen ihre eigne Überzeugung die Sache für bekannt annahm und als entschieden voraussetzte, daß ein freundschaftliches, ruhiges Verhältnis zwischen ihrem Gatten und Ottilien möglich sei.","<MERGE> Elective Affinities Ottilie had not given up Edward how could she? although Charlotte, wisely enough, in spite of her convic tion to the contrary, assumed it as a thing of course, and resolutely took it as decided that a quiet rational regard was possible between her husband and Ottilie."
79,108.wahlverwandtschaften_0902_librivox_64kb_mp3,1.17_89.flac,00017-f000096,0.8435530000000001,"Wie oft aber lag diese nachts, wenn sie sich eingeschlossen, auf den Knieen vor dem eröffneten Koffer und betrachtete die Geburtstagsgeschenke, von denen sie noch nichts gebraucht, nichts zerschnitten, nichts gefertigt.","How often, however, did not Ottilie remain at nights, after bolting herself into her room, on her knees before the open box, gazing at the birthday presents, of which as yet she had not touched a single thing not cut out or made up a single dress!"
80,108.wahlverwandtschaften_0902_librivox_64kb_mp3,1.17_90.flac,00017-f000097,0.9523790000000001,"Wie oft eilte das gute Mädchen mit Sonnenaufgang aus dem Hause, in dem sie sonst alle ihre Glückseligkeit gefunden hatte, ins Freie hinaus, in die Gegend, die sie sonst nicht ansprach.","How often with the sunrise did the poor girl hurry out of the house, in which she once had found all her happiness, away into the free air, into the country which then had had no charms for her!"
81,108.wahlverwandtschaften_0902_librivox_64kb_mp3,1.17_91.flac,00017-f000098,0.08448530000000001,Auch auf dem Boden mochte sie nicht verweilen.,"Even on the solid earth she could not bear to stay; she would spring into the boat, and row out into the middle of the lake, and there, drawing out some book of travels, lie rocked by the motion of the waves, reading and dream ing that she was far away, where she would never fail to find her friend she remaining ever nearest to his heart, and he to hers."
82,108.wahlverwandtschaften_0902_librivox_64kb_mp3,1.17_92.flac,00017-f000098,0.08448530000000001,"Sie sprang in den Kahn und ruderte sich bis mitten in den See; dann zog sie eine Reisebeschreibung hervor, ließ sich von den bewegten Wellen schaukeln, las, träumte sich in die Fremde, und immer fand sie dort ihren Freund; seinem Herzen war sie noch immer nahe geblieben, er dem ihrigen.","<MERGE> Even on the solid earth she could not bear to stay; she would spring into the boat, and row out into the middle of the lake, and there, drawing out some book of travels, lie rocked by the motion of the waves, reading and dream ing that she was far away, where she would never fail to find her friend she remaining ever nearest to his heart, and he to hers."
