,book,DE_audio,EN_audio,score,DE_transcript,EN_transcript
0,108.wahlverwandtschaften_0902_librivox_64kb_mp3,1.16_1.flac,00016-f000003,0.147688,Er und Charlotte hatten abends vorher schon halben und einsilbigen Abschied genommen.,"He and Charlotte had already taken a half leave of each other the evening before she felt that the parting was forever, and she resigned herself to it; for in the Count's second letter, which the Captain had at last shown to her, there was a hint of a prospect of an advantageous marriage, and, although he had paid no attention to it at all, she accepted it for as good as certain, and gave him up firmly and fully."
1,108.wahlverwandtschaften_0902_librivox_64kb_mp3,1.16_2.flac,00016-f000003,0.147688,"Sie empfand eine ewige Trennung und ergab sich darein; denn in dem zweiten Briefe des Grafen, den ihr der Hauptmann zuletzt mitteilte, war auch von einer Aussicht auf eine vorteilhafte Heirat die Rede, und obgleich er diesem Punkt keine Aufmerksamkeit schenkte, so hielt sie doch die Sache schon für gewiß und entsagte ihm rein und völlig.","<MERGE> He and Charlotte had already taken a half leave of each other the evening before she felt that the parting was forever, and she resigned herself to it; for in the Count's second letter, which the Captain had at last shown to her, there was a hint of a prospect of an advantageous marriage, and, although he had paid no attention to it at all, she accepted it for as good as certain, and gave him up firmly and fully."
2,108.wahlverwandtschaften_0902_librivox_64kb_mp3,1.16_3.flac,00016-f000004,-0.0203226,"Dagegen glaubte sie nun auch die Gewalt, die sie über sich selbst ausgeübt, von andern fordern zu können.","Now, therefore, she thought that she had a right to require of others the same control over themselves which she had exercised herself: it had not been impossible to her, and it ought not to be impossible to them."
3,108.wahlverwandtschaften_0902_librivox_64kb_mp3,1.16_4.flac,00016-f000004,-0.0203226,"Ihr war es nicht unmöglich gewesen, andern sollte das gleiche möglich sein.","<MERGE> Now, therefore, she thought that she had a right to require of others the same control over themselves which she had exercised herself: it had not been impossible to her, and it ought not to be impossible to them."
4,108.wahlverwandtschaften_0902_librivox_64kb_mp3,1.16_5.flac,00016-f000005,0.5556,"In diesem Sinne begann sie das Gespräch mit ihrem Gemahl, um so mehr offen und zuversichtlich, als sie empfand, daß die Sache ein für allemal abgetan werden müsse.","With this feeling she began the conversation with her husband; and she entered upon it the more openly and easily, from a sense that the question must now, once for all, be de cisively set at rest."
5,108.wahlverwandtschaften_0902_librivox_64kb_mp3,1.16_6.flac,00016-f000006,0.70418,"Unser Freund hat uns verlassen, sagte sie; wir sind nun wieder gegeneinander über wie vormals, und es käme nun wohl auf uns an, ob wir wieder völlig in den alten Zustand zurückkehren wollten.","Our friend has left us, she said; we are now once more together as we were and it depends upon our selves whether we choose to return altogether into our old position."
6,108.wahlverwandtschaften_0902_librivox_64kb_mp3,1.16_7.flac,00016-f000007,0.669658,"Eduard, der nichts vernahm, als was seiner Leidenschaft schmeichelte, glaubte, daß Charlotte durch diese Worte den früheren Witwenstand bezeichnen und, obgleich auf unbestimmte Weise, zu einer Scheidung Hoffnung machen wolle.","Elective Affinities Edward, who heard nothing except what flattered his own passion, believed that Charlotte, in these words, was alluding to her previous widowed state, and, in a round about way, was making a suggestion for a separation; so that he answered, with a laugh, Why not? all we want is to come to an understanding."
7,108.wahlverwandtschaften_0902_librivox_64kb_mp3,1.16_8.flac,00016-f000008,-0.08294119999999999,Er antwortete deshalb mit Lächeln: Warum nicht?,"But he found himself sorely enough undeceived, as Charlotte continued, And we have now a choice of opportunities for placing Ottilie in another situation."
8,108.wahlverwandtschaften_0902_librivox_64kb_mp3,1.16_9.flac,00016-f000008,-0.08294119999999999,"Es käme nur darauf an, daß man sich verständigte.","<MERGE> But he found himself sorely enough undeceived, as Charlotte continued, And we have now a choice of opportunities for placing Ottilie in another situation."
9,108.wahlverwandtschaften_0902_librivox_64kb_mp3,1.16_10.flac,00016-f000009,0.500505,"Er fand sich daher gar sehr betrogen, als Charlotte versetzte:",Two openings have offered them selves for her either of which will do very well.
10,108.wahlverwandtschaften_0902_librivox_64kb_mp3,1.16_11.flac,00016-f000010,0.311278,"Auch Ottilien in eine andere Lage zu bringen, haben wir gegenwärtig nur zu wählen; denn es findet sich eine doppelte Gelegenheit, ihr Verhältnisse zu geben, die für sie wünschenswert sind. Sie kann in die Pension zurückkehren, da meine Tochter zur Großtante gezogen ist; sie kann in ein angesehenes Haus aufgenommen werden, um mit einer einzigen Tochter alle Vorteile einer standesmäßigen Erziehung zu genießen.","Either she can return to the school, as my daughter has left it and is with her greataunt; or she can be received into a desirable family, where, as the companion of an only child, she will enjoy all the advantages of a solid edu cation."
11,108.wahlverwandtschaften_0902_librivox_64kb_mp3,1.16_12.flac,00016-f000011,0.912919,"Indessen, versetzte Eduard ziemlich gefaßt, hat Ottilie sich in unserer freundlichen Gesellschaft so verwöhnt, daß ihr eine andere wohl schwerlich willkommen sein möchte.","Edward, with a tolerably successful effort at command ing himself, replied, Ottilie has been so much spoiled, by living so long with us here, that she will scarcely like to leave us now."
12,108.wahlverwandtschaften_0902_librivox_64kb_mp3,1.16_13.flac,00016-f000012,0.7320300000000001,"Wir haben uns alle verwöhnt, sagte Charlotte, und du nicht zum letzten.","We have all of us been too much spoiled, said Char lotte; and yourself not least."
13,108.wahlverwandtschaften_0902_librivox_64kb_mp3,1.16_15.flac,00016-f000015,1.02,"Wenigstens finde ich es nicht billig, versetzte Eduard, daß Ottilie aufgeopfert werde, und das geschähe doch, wenn man sie gegenwärtig unter fremde Menschen hinunterstieße.","At any rate I can not see that it is right that Ottilie should be made a sacrifice, replied Edward; and that would be the case if we were now to allow her to be sent away among strangers."
14,108.wahlverwandtschaften_0902_librivox_64kb_mp3,1.16_16.flac,00016-f000016,0.500041,"Den Hauptmann hat sein gutes Geschick hier aufgesucht; wir dürfen ihn mit Ruhe, ja mit Behagen von uns wegscheiden lassen. Wer weiß, was Ottilien bevorsteht; warum sollten wir uns übereilen?.Was uns bevorsteht, ist ziemlich klar, versetzte Charlotte mit einiger Bewegung, und da sie die Absicht hatte, ein für allemal sich auszusprechen, fuhr sie fort:","The Captain's good genius has Elective Affinities sought him out here we can feel easy, we can feel happy at seeing him leave us; but who can tell what may be before Ottilie?"
15,108.wahlverwandtschaften_0902_librivox_64kb_mp3,1.16_17.flac,00016-f000017,0.177778,"Du liebst Ottilien, du gewöhnst dich an sie.",There is no occasion for haste.
16,108.wahlverwandtschaften_0902_librivox_64kb_mp3,1.16_18.flac,00016-f000019,0.757143,Neigung und Leidenschaft entspringt und nährt sich auch von ihrer Seite.,"A reciprocal feeling is rising on her side as well, and feed ing itself in the same way."
17,108.wahlverwandtschaften_0902_librivox_64kb_mp3,1.16_19.flac,00016-f000020,0.508,"Warum sollen wir nicht mit Worten aussprechen, was uns jede Stunde gesteht und bekennt?",Why should we not ac knowledge in words what every hour makes obvious? and are we not to have the common prudence to ask our selves in what it is to end?
18,108.wahlverwandtschaften_0902_librivox_64kb_mp3,1.16_20.flac,00016-f000021,0.596232,"Sollen wir nicht soviel Vorsicht haben, uns zu fragen, was das werden wird?.Wenn man auch sogleich nicht darauf antworten kann, versetzte Eduard, der sich zusammennahm, so läßt sich doch soviel sagen, daß man eben alsdann sich am ersten entschließt abzuwarten, was uns die Zukunft lehren wird, wenn man gerade nicht sagen kann, was aus einer Sache werden soll.","We may not be able to find an answer on the mo ment, replied Edward, collecting himself; but so much may be said, that if we can not exactly tell what will come of it, we may resign ourselves to wait and see what the future may tell us about it."
19,108.wahlverwandtschaften_0902_librivox_64kb_mp3,1.16_21.flac,00016-f000022,0.525455,"Hier vorauszusehen, versetzte Charlotte, bedarf es wohl keiner großen Weisheit, und soviel läßt sich auf alle Fälle gleich sagen, daß wir beide nicht mehr jung genug sind, um blindlings dahin zu gehen, wohin man nicht möchte oder nicht sollte.","No great wisdom is required to prophesy here, an swered Charlotte; and, at any rate, we ought to feel that you and I are past the age when people may walk blindly where they should not or ought not to go."
20,108.wahlverwandtschaften_0902_librivox_64kb_mp3,1.16_22.flac,00016-f000023,0.7875,"Niemand kann mehr für uns sorgen; wir müssen unsre eigenen Freunde sein, unsre eigenen Hofmeister.","There is no one else to take care of us we must be our own friends, our own managers."
21,108.wahlverwandtschaften_0902_librivox_64kb_mp3,1.16_23.flac,00016-f000024,0.704006,"Niemand erwartet von uns, daß wir uns in ein Äußerstes verlieren werden, niemand erwartet, uns tadelnswert oder gar lächerlich zu finden.",No one expects us to com mit ourselves in an outrage upon decency; no one expects that we are going to expose ourselves to censure or to ridicule.
22,108.wahlverwandtschaften_0902_librivox_64kb_mp3,1.16_25.flac,00016-f000027,0.25,"Denke dir aufrichtig und ohne Selbstbetrug Ottilien aus unserer Gesellschaft gerissen und fremden Menschen untergeben ich wenigstens fühle mich nicht grausam genug, ihr eine solche Veränderung zuzumuten.","I do not mean future happiness no one can count on that but what is present, palpable, and imme diate."
23,108.wahlverwandtschaften_0902_librivox_64kb_mp3,1.16_26.flac,00016-f000030,0.474247,Charlotte ward gar wohl die Entschlossenheit ihres Gemahls hinter seiner Verstellung gewahr.,Charlotte saw too clearly into her husband's inten tions through this disguise.
24,108.wahlverwandtschaften_0902_librivox_64kb_mp3,1.16_27.flac,00016-f000031,0.502467,"Erst jetzt fühlte sie, wie weit er sich von ihr entfernt hatte.",For the first time she felt how far he had estranged himself from her.
25,108.wahlverwandtschaften_0902_librivox_64kb_mp3,1.16_28.flac,00016-f000031,0.02,Mit einiger Bewegung rief sie aus:,For the first time she felt how far he had estranged himself from her.
26,108.wahlverwandtschaften_0902_librivox_64kb_mp3,1.16_30.flac,00016-f000034,0.177,"Wer wird auch gleich das Äußerste denken!.Das Äußerste liegt der Leidenschaft zu allernächst, bemerkte Charlotte.","Our children, I should have thought, were sufficiently provided for, said Edward, with a cold smile; adding, rather more kindly, but why at once expect the very worst ?"
27,108.wahlverwandtschaften_0902_librivox_64kb_mp3,1.16_31.flac,00016-f000035,0.631579,"Lehne, solange es noch Zeit ist, den guten Rat nicht ab, nicht die Hülfe, die ich uns biete.","The very worst is too sure to follow this passion of yours, returned Charlotte; do not refuse good advice while there is yet time; do not throw away the means which I propose to save us."
28,108.wahlverwandtschaften_0902_librivox_64kb_mp3,1.16_32.flac,00016-f000036,0.968114,"In trüben Fällen muß derjenige wirken und helfen, der am klarsten sieht.",In troubled cases those must work and help who see the clearest this time it is I.
29,108.wahlverwandtschaften_0902_librivox_64kb_mp3,1.16_33.flac,00016-f000037,-0.09375,Diesmal bin ichs.,re nounce my fairest rights! renounce you!
30,108.wahlverwandtschaften_0902_librivox_64kb_mp3,1.16_34.flac,00016-f000038,0.223077,"Lieber, liebster Eduard, laß mich gewähren!","Who says that? replied Edward, with some embar rassment."
31,108.wahlverwandtschaften_0902_librivox_64kb_mp3,1.16_35.flac,00016-f000039,0.931661,"Kannst du mir zumuten, daß ich auf mein wohlerworbenes Glück, auf die schönsten Rechte, auf dich so geradehin Verzicht leisten soll?.Wer sagt das?","You, yourself, answered Charlotte; in determin ing to keep Ottilie here, are you not acknowledging everything which must arise out of it?"
32,108.wahlverwandtschaften_0902_librivox_64kb_mp3,1.16_36.flac,00016-f000040,0.0717726,versetzte Eduard mit einiger Verlegenheit.,"I will urge noth Elective Affinities ing on you but if you can not conquer yourself, at least you will not be able much longer to deceive yourself."
33,108.wahlverwandtschaften_0902_librivox_64kb_mp3,1.16_37.flac,00016-f000040,0.0717726,"Du selbst, versetzte Charlotte; indem du Ottilien in der Nähe behalten willst, gestehst du nicht alles zu, was daraus entspringen muß? Ich will nicht in dich dringen; aber wenn du dich nicht überwinden kannst, so wirst du wenigstens dich nicht lange mehr betriegen können.","<MERGE> I will urge noth Elective Affinities ing on you but if you can not conquer yourself, at least you will not be able much longer to deceive yourself."
34,108.wahlverwandtschaften_0902_librivox_64kb_mp3,1.16_38.flac,00016-f000041,0.670879,"Eduard fühlte, wie recht sie hatte.",Edward felt how right she was.
35,108.wahlverwandtschaften_0902_librivox_64kb_mp3,1.16_39.flac,00016-f000042,0.225,"Ein ausgesprochnes Wort ist fürchterlich, wenn es das auf einmal ausspricht, was das Herz lange sich erlaubt hat; und um nur für den Augenblick auszuweichen, erwiderte Eduard:","It is fearful to hear spoken out, in words, what the heart has gone on long permitting to itself in secret."
36,108.wahlverwandtschaften_0902_librivox_64kb_mp3,1.16_40.flac,00016-f000043,0.122727,"Es ist mir ja noch nicht einmal klar, was du vorhast.","To escape only for a mo ment, Edward answered, It is not yet clear to me what you want."
37,108.wahlverwandtschaften_0902_librivox_64kb_mp3,1.16_41.flac,00016-f000044,0.469125,"Meine Absicht war, versetzte Charlotte, mit dir die beiden Vorschläge zu überlegen.","My intention, she replied, was to talk over with you these two proposals each of them has its advan tages."
38,108.wahlverwandtschaften_0902_librivox_64kb_mp3,1.16_42.flac,00016-f000045,0.0939935,Beide haben viel Gutes.,"The school would be best suited to her, as she now is; but the other situation is larger, and wider, and promises more, when I think what she may become."
39,108.wahlverwandtschaften_0902_librivox_64kb_mp3,1.16_43.flac,00016-f000043,0.4575,"Die Pension würde Ottilien am gemäßesten sein, wenn ich betrachte, wie das Kind jetzt ist.","To escape only for a mo ment, Edward answered, It is not yet clear to me what you want."
40,108.wahlverwandtschaften_0902_librivox_64kb_mp3,1.16_44.flac,00016-f000044,0.444643,"Jene größere und weitere Lage verspricht aber mehr, wenn ich bedenke, was sie werden soll.","My intention, she replied, was to talk over with you these two proposals each of them has its advan tages."
41,108.wahlverwandtschaften_0902_librivox_64kb_mp3,1.16_45.flac,00016-f000045,0.523193,Sie legte darauf umständlich ihrem Gemahl die beiden Verhältnisse dar und schloß mit den Worten:,"The school would be best suited to her, as she now is; but the other situation is larger, and wider, and promises more, when I think what she may become."
42,108.wahlverwandtschaften_0902_librivox_64kb_mp3,1.16_46.flac,00016-f000046,0.546635,"Was meine Meinung betrifft, so würde ich das Haus jener Dame der Pension vorziehen aus mehreren Ursachen, besonders aber auch, weil ich die Neigung, ja die Leidenschaft des jungen Mannes, den Ottilie dort für sich gewonnen, nicht vermehren will.","She then detailed to her husband circumstantially what would lie before Ottilie in each position, and concluded with the words, For my own part I should prefer the lady's house to the school, for more reasons than one; but particularly because I should not like the affection, the love indeed, of the young man there, which Ottilie has gained, to increase."
43,108.wahlverwandtschaften_0902_librivox_64kb_mp3,1.16_47.flac,00016-f000049,0.475,"Eduard schien ihr Beifall zu geben, nur aber, um einigen Aufschub zu suchen.",Edward shuddered he thought he was betrayed.
44,108.wahlverwandtschaften_0902_librivox_64kb_mp3,1.16_48.flac,00016-f000048,0.780089,"Charlotte, die darauf ausging, etwas Entscheidendes zu tun, ergriff sogleich die Gelegenheit, als Eduard nicht unmittelbar widersprach, die Abreise Ottiliens, zu der sie schon alles im stillen vorbereitet hatte, auf die nächsten Tage festzusetzen.","Charlotte, who desired to commit him to a definite step, seized the opportunity, as Edward made no immediate opposition, to settle Ottilie's depart ure, for which she had already privately made all prep arations for the next day."
45,108.wahlverwandtschaften_0902_librivox_64kb_mp3,1.16_49.flac,00016-f000051,0.590571,"Eduard schauderte, er hielt sich für verraten und die liebevolle Sprache seiner Frau für ausgedacht, künstlich und planmäßig, um ihn auf ewig von seinem Glücke zu trennen.",He appeared to leave the thing entirely to her; but in his Elective Affinities heart his resolution was already taken.
46,108.wahlverwandtschaften_0902_librivox_64kb_mp3,1.16_50.flac,00016-f000051,0.4125,Er schien ihr die Sache ganz zu überlassen; allein schon war innerlich sein Entschluß gefaßt.,He appeared to leave the thing entirely to her; but in his Elective Affinities heart his resolution was already taken.
47,108.wahlverwandtschaften_0902_librivox_64kb_mp3,1.16_51.flac,00016-f000053,0.578705,"Um nur zu Atem zu kommen, um das bevorstehende unabsehliche Unheil der Entfernung Ottiliens abzuwenden, entschied er sich, sein Haus zu verlassen, und zwar nicht ganz ohne Vorbewußt Charlottens, die er jedoch durch die Einleitung zu täuschen verstand, daß er bei Ottiliens Abreise nicht gegenwärtig sein, ja sie von diesem Augenblick an nicht mehr sehen wolle.","He told Charlotte he was going; but he had blinded her to his real reason, by telling her that he would not be present at Ottilie's departure; indeed, that, from that moment, he would see her no more."
48,108.wahlverwandtschaften_0902_librivox_64kb_mp3,1.16_52.flac,00016-f000054,1.05502,"Charlotte, die gewonnen zu haben glaubte, tat ihm allen Vorschub.","Charlotte, who believed that she had gained her point, approved most cordially."
49,108.wahlverwandtschaften_0902_librivox_64kb_mp3,1.16_53.flac,00016-f000055,0.22707,"Er befahl seine Pferde, gab dem Kammerdiener die nötige Anweisung, was er einpacken und wie er ihm folgen solle, und so, wie schon im Stegreife, setzte er sich hin und schrieb.","He ordered his horse, gave his valet the necessary directions what to pack up, and where he should follow him; and then, on the point of departure, he sat down and wrote: EDWARD TO CHARLOTTE The misfortune, my love, which has befallen us, may or may not admit of remedy; only this I feel, that if I am not at once to be driven to despair, I must find some means of delay for myself, and for all of us."
50,108.wahlverwandtschaften_0902_librivox_64kb_mp3,1.16_54.flac,00016-f000055,0.22707,"Das Übel, meine Liebe, das uns befallen hat, mag heilbar sein oder nicht, dies nur fühle ich: wenn ich im Augenblicke nicht verzweifeln soll, so muß ich Aufschub finden für mich, für uns alle.","<MERGE> He ordered his horse, gave his valet the necessary directions what to pack up, and where he should follow him; and then, on the point of departure, he sat down and wrote: EDWARD TO CHARLOTTE The misfortune, my love, which has befallen us, may or may not admit of remedy; only this I feel, that if I am not at once to be driven to despair, I must find some means of delay for myself, and for all of us."
51,108.wahlverwandtschaften_0902_librivox_64kb_mp3,1.16_55.flac,00016-f000056,0.912162,"Indem ich mich aufopfre, kann ich fordern.","In making myself the sacrifice, I have a right to make a request."
52,108.wahlverwandtschaften_0902_librivox_64kb_mp3,1.16_56.flac,00016-f000057,0.992308,"Ich verlasse mein Haus und kehre nur unter günstigern, ruhigern Aussichten zurück.","I am leaving my home, and I only return to it under hap pier and more peaceful auspices."
53,108.wahlverwandtschaften_0902_librivox_64kb_mp3,1.16_57.flac,00016-f000058,0.925758,"Du sollst es indessen besitzen, aber mit Ottilien.","While I am away, you keep possession of it but with Ottiliv."
54,108.wahlverwandtschaften_0902_librivox_64kb_mp3,1.16_58.flac,00016-f000059,0.5607270000000001,"Bei dir will ich sie wissen, nicht unter fremden Menschen.","I choose to know that she is with you, and not among strangers."
55,108.wahlverwandtschaften_0902_librivox_64kb_mp3,1.16_59.flac,00016-f000060,0.814954,"Sorge für sie, behandle sie wie sonst, wie bisher, ja nur immer liebevoller, freundlicher und zarter.","Take care of her; treat her as you have treated her only more lovingly, more kindly, more tenderly!"
56,108.wahlverwandtschaften_0902_librivox_64kb_mp3,1.16_60.flac,00016-f000061,0.889286,"Ich verspreche, kein heimliches Verhältnis zu Ottilien zu suchen.",I promise that I will not attempt any secret intercourse with her.
57,108.wahlverwandtschaften_0902_librivox_64kb_mp3,1.16_61.flac,00016-f000062,0.420833,"Laßt mich lieber eine Zeitlang ganz unwissend, wie ihr lebt; ich will mir das Beste denken.","Leave me, as long a time as you please, without knowing any thing about you."
58,108.wahlverwandtschaften_0902_librivox_64kb_mp3,1.16_62.flac,00016-f000063,0.22387100000000001,Denkt auch so von mir.,"I will not allow myself to be anxious nor need you be uneasy about me; only, with all my Elective Affinities heart and soul, I beseech you make no attempt to send Ottilie away, or to introduce her into any other situation."
59,108.wahlverwandtschaften_0902_librivox_64kb_mp3,1.16_63.flac,00016-f000063,0.22387100000000001,"Nur, was ich dich bitte, auf das innigste, auf das lebhafteste: mache keinen Versuch, Ottilien sonst irgendwo unterzugeben, in neue Verhältnisse zu bringen!","<MERGE> I will not allow myself to be anxious nor need you be uneasy about me; only, with all my Elective Affinities heart and soul, I beseech you make no attempt to send Ottilie away, or to introduce her into any other situation."
60,108.wahlverwandtschaften_0902_librivox_64kb_mp3,1.16_64.flac,00016-f000064,0.5862390000000001,"Außer dem Bezirk deines Schlosses, deines Parks, fremden Menschen anvertraut, gehört sie mir, und ich werde mich ihrer bemächtigen.","Beyond the circle of the castle and the park, placed in the hands of strangers, she belongs to me, and I will take possession of her !"
61,108.wahlverwandtschaften_0902_librivox_64kb_mp3,1.16_65.flac,00016-f000065,0.691152,"Ehrst du aber meine Neigung, meine Wünsche, meine Schmerzen, schmeichelst du meinem Wahn meinen Hoffnungen, so will ich auch der Genesung nicht widerstreben, wenn sie sich mir anbietet.","If you have any regard for my affec tion, for my wishes, for my sufferings, you will leave me alone to my madness; and if any hope of recovery from it should ever hereafter offer itself to me, I will not resist."
62,108.wahlverwandtschaften_0902_librivox_64kb_mp3,1.16_66.flac,00016-f000066,0.696321,"Diese letzte Wendung floß ihm aus der Feder, nicht aus dem Herzen.",This last sentence ran off his pen not out of his heart.
63,108.wahlverwandtschaften_0902_librivox_64kb_mp3,1.16_67.flac,00016-f000067,0.490756,"Ja, wie er sie auf dem Papier sah, fing er bitterlich an zu weinen.","Even when he saw it upon the paper, he began bitterly to weep."
64,108.wahlverwandtschaften_0902_librivox_64kb_mp3,1.16_68.flac,00016-f000069,0.464,"Er sollte auf irgendeine Weise dem Glück, ja dem Unglück, Ottilien zu lieben, entsagen!",He only now began to feel what he was doing he was going away without knowing what was to be the result.
65,108.wahlverwandtschaften_0902_librivox_64kb_mp3,1.16_69.flac,00016-f000071,0.111161,"Jetzt fühlte er, was er tat.","But the letter was written the horses were at the door; every moment he was afraid he might see Ottilie somewhere, and then his whole purpose would go to the winds."
66,108.wahlverwandtschaften_0902_librivox_64kb_mp3,1.16_70.flac,00016-f000070,0.332727,"Er entfernte sich, ohne zu wissen, was daraus entstehen konnte.",At any rate he was not to see her again now with what certainty could he promise him self that he would ever see her again?
67,108.wahlverwandtschaften_0902_librivox_64kb_mp3,1.16_71.flac,00016-f000072,0.353292,"Er sollte sie wenigstens jetzt nicht wiedersehen; ob er sie je wiedersähe, welche Sicherheit konnte er sich darüber versprechen? Aber der Brief war geschrieben; die Pferde standen vor der Tür; jeden Augenblick mußte er fürchten, Ottilien irgendwo zu erblicken und zugleich seinen Entschluß vereitelt zu sehen. Er faßte sich; er dachte, daß es ihm doch möglich sei, jeden Augenblick zurückzukehren und durch die Entfernung gerade seinen Wünschen näher zu kommen.","He collected himself he remembered that, at any rate, he would be able to return at any moment he pleased; and that, by his absence he would have advanced nearer to his wishes; on the other side, he pictured Ottilie to himself forced to leave the house if he stayed."
68,108.wahlverwandtschaften_0902_librivox_64kb_mp3,1.16_72.flac,00016-f000073,0.445865,"Im Gegenteil stellte er sich Ottilien vor, aus dem Hause gedrängt, wenn er bliebe.","He sealed the letter, ran down the steps, and sprang upon his horse."
