,book,DE_audio,EN_audio,score,DE_transcript,EN_transcript
76,108.wahlverwandtschaften_0902_librivox_64kb_mp3,1.18_86.flac,00018-f000102,0.533099,Denn was wollte er überhaupt Eduarden in diesem Augenblicke noch entgegensetzen?,"Indeed, if he stayed, what was there further which at that moment he could urge on Edward?"
77,108.wahlverwandtschaften_0902_librivox_64kb_mp3,1.18_87.flac,00018-f000103,0.6443479999999999,"Zeit zu gewinnen, zu erforschen, wie es um die Frauen stehe, das war es, was ihm selbst nach seinen eignen Gesinnungen zu tun übrigblieb.","To gain time, to inquire in what state things were with the ladies, was the best thing which even he himself could suggest as at present possible."
78,108.wahlverwandtschaften_0902_librivox_64kb_mp3,1.18_88.flac,00018-f000104,0.6170939999999999,"Er eilte zu Charlotten, die er wie sonst gefaßt und heiter fand.","Elective Affinities He hastened to Charlotte, whom he found as usual calm and in good spirits."
79,108.wahlverwandtschaften_0902_librivox_64kb_mp3,1.18_89.flac,00018-f000105,0.579,"Sie unterrichtete ihn gern von allem, was vorgefallen war; denn aus Eduards Reden konnte er nur die Wirkung abnehmen.",She told him readily of every thing which had occurred; for from what Edward had said he had only been able to gather the effects.
80,108.wahlverwandtschaften_0902_librivox_64kb_mp3,1.18_91.flac,00018-f000108,0.9620190000000001,"Wie verwundert, erstaunt und, nach seiner Gesinnung, erheitert war er daher, als Charlotte ihm in Gefolg so manches Unerfreulichen endlich sagte: Ich muß glauben, ich muß hoffen, daß alles sich wieder geben, daß Eduard sich wieder nähern werde.","It was a surprise, indeed, to him, but from his point of view an unspeakably delightful one, when Charlotte, at the end of a number of unpleasant things, finished with saying: I must believe, I must hope, that things will all work round again, and that Edward will return to me."
81,108.wahlverwandtschaften_0902_librivox_64kb_mp3,1.18_92.flac,00018-f000109,0.666084,"Wie kann es auch wohl anders sein, da Sie mich guter Hoffnung finden.","How can it be otherwise, as soon as I become a mother?"
82,108.wahlverwandtschaften_0902_librivox_64kb_mp3,1.18_93.flac,00018-f000110,0.640714,Versteh ich Sie recht? fiel Mittler ein.,Do I understand you right? returned Mittler.
83,108.wahlverwandtschaften_0902_librivox_64kb_mp3,1.18_94.flac,00018-f000111,0.27931,"Vollkommen, versetzte Charlotte.","Perfectly, Charlotte answered."
84,108.wahlverwandtschaften_0902_librivox_64kb_mp3,1.18_95.flac,00018-f000112,0.7681819999999999,"Tausendmal gesegnet sei mir diese Nachricht! rief er, die Hände zusammenschlagend.","A thousand times blessed be this news! he cried, clasping his hands together."
85,108.wahlverwandtschaften_0902_librivox_64kb_mp3,1.18_96.flac,00018-f000113,0.521663,Ich kenne die Stärke dieses Arguments auf ein männliches Gemüt.,I know the strength of this argument on the mind of a man.
86,108.wahlverwandtschaften_0902_librivox_64kb_mp3,1.18_97.flac,00018-f000114,0.8867649999999999,"Wie viele Heiraten sah ich dadurch beschleunigt, befestigt, wiederhergestellt!","Many a marriage have I seen first cemented by it, and restored again when broken."
87,108.wahlverwandtschaften_0902_librivox_64kb_mp3,1.18_98.flac,00018-f000115,0.6668569999999999,"Mehr als tausend Worte wirkt eine solche gute Hoffnung, die fürwahr die beste Hoffnung ist, die wir haben können.",Such a good hope as this is worth more than a thousand words.
88,108.wahlverwandtschaften_0902_librivox_64kb_mp3,1.18_99.flac,00018-f000117,0.636066,"Doch, fuhr er fort, was mich betrifft, so hätte ich alle Ursache, verdrießlich zu sein.","For myself, though, he continued, I have all reason to be vexed about it."
89,108.wahlverwandtschaften_0902_librivox_64kb_mp3,1.18_100.flac,00018-f000118,1.00263,"In diesem Falle, sehe ich wohl, wird meiner Eigenliebe nicht geschmeichelt.",In this case I can see clearly no selflove of mine will be flattered.
90,108.wahlverwandtschaften_0902_librivox_64kb_mp3,1.18_101.flac,00018-f000118,0.5615939999999999,Bei euch kann meine Tätigkeit keinen Dank verdienen.,In this case I can see clearly no selflove of mine will be flattered.
91,108.wahlverwandtschaften_0902_librivox_64kb_mp3,1.18_102.flac,00018-f000119,0.4753020000000001,"Ich komme mir vor wie jener Arzt, mein Freund, dem alle Kuren gelangen, die er um Gottes willen an Armen tat, der aber selten einen Reichen heilen konnte, der es gut bezahlen wollte.","I shall earn no thanks from you by my services; I am in the same case as a certain medical friend of mine, who suc ceeds in all cures which he undertakes with the poor for the love of God; but can seldom do anything for the rich who will pay him."
92,108.wahlverwandtschaften_0902_librivox_64kb_mp3,1.18_103.flac,00018-f000120,0.464099,"Glücklicherweise hilft sich hier die Sache von selbst, da meine Bemühungen, mein Zureden fruchtlos geblieben wären.","Here, thank God the thing Elective Affinities cures itself, after all my talking and trying had proved fruitless."
93,108.wahlverwandtschaften_0902_librivox_64kb_mp3,1.18_104.flac,00018-f000121,0.15972999999999998,"Charlotte verlangte nun von ihm, er solle die Nachricht Eduarden bringen, einen Brief von ihr mitnehmen und sehen, was zu tun, was herzustellen sei.","Charlotte now asked him if he would carry the news to Edward; if he would take a letter to him from her, and then see what should be done."
94,108.wahlverwandtschaften_0902_librivox_64kb_mp3,1.18_105.flac,00018-f000121,0.15972999999999998,Er wollte das nicht eingehen.,"<MERGE> Charlotte now asked him if he would carry the news to Edward; if he would take a letter to him from her, and then see what should be done."
95,108.wahlverwandtschaften_0902_librivox_64kb_mp3,1.18_106.flac,00018-f000122,0.3,"Alles ist schon getan, rief er aus.",But he declined under taking this.
96,108.wahlverwandtschaften_0902_librivox_64kb_mp3,1.18_107.flac,00018-f000123,1.29047,Schreiben Sie! ein jeder Bote ist so gut als ich.,"All is done, he cried; do you write your letter any messenger will do as well as I I will come back to wish you joy."
97,108.wahlverwandtschaften_0902_librivox_64kb_mp3,1.18_108.flac,00018-f000124,0.901587,"Muß ich doch meine Schritte hinwenden, wo ich nötiger bin.",I will come to the christening!
98,108.wahlverwandtschaften_0902_librivox_64kb_mp3,1.18_109.flac,00018-f000125,0.519231,"Ich komme nur wieder, um Glück zu wünschen; ich komme zur Taufe.",For this refusal she was vexed with him as she fre quently was.
99,108.wahlverwandtschaften_0902_librivox_64kb_mp3,1.18_111.flac,00018-f000126,0.661517,"Sein rasches Wesen brachte manches Gute hervor, aber seine Übereilung war schuld an manchem Mißlingen.","His eager, impetuous character brought about much good; but his overhaste was the occasion of many a failure."
100,108.wahlverwandtschaften_0902_librivox_64kb_mp3,1.18_112.flac,00018-f000127,0.576562,Niemand war abhängiger von augenblicklich vorgefaßten Meinungen als er.,No one was more dependent than he on the impressions which he formed on the moment.
101,108.wahlverwandtschaften_0902_librivox_64kb_mp3,1.18_113.flac,00018-f000128,0.545082,"Charlottens Bote kam zu Eduarden, der ihn mit halbem Schrecken empfing.","Charlotte's messenger came to Edward, who received him half in terror."
102,108.wahlverwandtschaften_0902_librivox_64kb_mp3,1.18_114.flac,00018-f000129,0.519786,Der Brief konnte ebensogut für Nein als für Ja entscheiden.,"The letter was to decide his fate, and it might as well contain No as Yes."
103,108.wahlverwandtschaften_0902_librivox_64kb_mp3,1.18_115.flac,00018-f000130,0.115385,"Er wagte lange nicht, ihn aufzubrechen, und wie stand er betroffen, als er das Blatt gelesen, versteinert bei folgender Stelle, womit es sich endigte.","He did not venture, for a long time, to open it."
104,108.wahlverwandtschaften_0902_librivox_64kb_mp3,1.18_116.flac,00018-f000131,0.54142,"Gedenke jener nächtlichen Stunden, in denen du deine Gattin abenteuerlich als Liebender besuchtest, sie unwiderstehlich an dich zogst, sie als eine Geliebte, als eine Braut in die Arme schlossest.","At last he tore off the cover, and stood petrified at the following passage, with which it concluded: Remember the nightadventure when you visited your wife as a lover how you drew her to you, and clasped her as a wellbeloved bride in your arms."
105,108.wahlverwandtschaften_0902_librivox_64kb_mp3,1.18_117.flac,00018-f000132,0.502831,"Laß uns in dieser seltsamen Zufälligkeit eine Fügung des Himmels verehren, die für ein neues Band unserer Verhältnisse gesorgt hat in dem Augenblick, da das Glück unseres Lebens auseinanderzufallen und zu verschwinden droht.","In this strange accident let us revere the providence of Heaven, which has woven a new link to bind us at the moment when the happiness of our lives was threatening to fall asun der and to vanish."
106,108.wahlverwandtschaften_0902_librivox_64kb_mp3,1.18_118.flac,00018-f000133,0.648529,"Was von dem Augenblick an in der Seele Eduards vorging, würde schwer zu schildern sein.",What passed from that moment in Edward's soul it would be difficult to describe !
107,108.wahlverwandtschaften_0902_librivox_64kb_mp3,1.18_119.flac,00018-f000134,0.845455,"In einem solchen Gedränge treten zuletzt alte Gewohnheiten, alte Neigungen wieder hervor, um die Zeit zu töten und den Lebensraum auszufüllen.",Under the weight of such Elective Affinities a stroke old habits and fancies come out again to assist to kill the time and fill up the chasms of life.
108,108.wahlverwandtschaften_0902_librivox_64kb_mp3,1.18_120.flac,00018-f000135,0.19206,Jagd und Krieg sind eine solche für den Edelmann immer bereite Aushülfe.,Hunting and fighting are an everready resource of this kind for a nobleman; Edward longed for some outward peril as a counterbalance to the storm within him.
109,108.wahlverwandtschaften_0902_librivox_64kb_mp3,1.18_121.flac,00018-f000136,0.502444,"Eduard sehnte sich nach äußerer Gefahr, um der innerlichen das Gleichgewicht zu halten.","He craved for death, because the burden of life threatened to become too heavy for him to bear."
110,108.wahlverwandtschaften_0902_librivox_64kb_mp3,1.18_122.flac,00018-f000137,0.627835,"Er sehnte sich nach dem Untergang, weil ihm das Dasein unerträglich zu werden drohte; ja es war ihm ein Trost zu denken, daß er nicht mehr sein werde und eben dadurch seine Geliebten, seine Freunde glücklich machen könne.","It comforted him to think that he would soon cease to be, and so would make those whom he loved happy by his departure."
111,108.wahlverwandtschaften_0902_librivox_64kb_mp3,1.18_123.flac,00018-f000138,0.988558,"Niemand stellte seinem Willen ein Hindernis entgegen, da er seinen Entschluß verheimlichte.",No one made any difficulty in his doing what he pur posed because he kept his intention a secret.
112,108.wahlverwandtschaften_0902_librivox_64kb_mp3,1.18_124.flac,00018-f000139,0.375,"Mit allen Förmlichkeiten setzte er sein Testament auf; es war ihm eine süße Empfindung, Ottilien das Gut vermachen zu können.",He made his will with all due formalities.
113,108.wahlverwandtschaften_0902_librivox_64kb_mp3,1.18_125.flac,00018-f000140,-0.00115385,"Für Charlotten, für das Ungeborne, für den Hauptmann, für seine Dienerschaft war gesorgt.","It gave him a very sweet feeling to secure Ottilie's fortune provision was made for Charlotte, for the unborn child, for the Cap tain, and for the servants."
114,108.wahlverwandtschaften_0902_librivox_64kb_mp3,1.18_126.flac,00018-f000140,-0.00115385,Der wieder ausgebrochene Krieg begünstigte sein Vorhaben.,"<MERGE> It gave him a very sweet feeling to secure Ottilie's fortune provision was made for Charlotte, for the unborn child, for the Cap tain, and for the servants."
115,108.wahlverwandtschaften_0902_librivox_64kb_mp3,1.18_127.flac,00018-f000141,0.626471,Militärische Halbheiten hatten ihm in seiner Jugend viel zu schaffen gemacht; er hatte deswegen den Dienst verlassen.,"The war, which had again broken out, favored his wishes: he had disliked exceed ingly the halfsoldiering which had fallen to him in his youth, and that was the reason why he had left the service."
116,108.wahlverwandtschaften_0902_librivox_64kb_mp3,1.18_128.flac,00018-f000142,0.591489,"Nun war es ihm eine herrliche Empfindung, mit einem Feldherrn zu ziehen, von dem er sich sagen konnte: unter seiner Anführung ist der Tod wahrscheinlich und der Sieg gewiß.","Now it gave him a fine exhilarating feeling to be able to rejoin it, under a commander of whom it could be said that under his conduct death was likely and victory was sure."
117,108.wahlverwandtschaften_0902_librivox_64kb_mp3,1.18_129.flac,00018-f000143,0.946926,"Ottilie, nachdem auch ihr Charlottens Geheimnis bekannt geworden, betroffen wie Eduard, und mehr, ging in sich zurück.","Ottilie, when Charlotte's secret was made known to her, bewildered by it, like Edward, and more than he, retired into herself she had nothing further to say: hope she could not, and wish she dared not."
118,108.wahlverwandtschaften_0902_librivox_64kb_mp3,1.18_130.flac,00018-f000143,-0.0700084,Sie hatte nichts weiter zu sagen.,"<MERGE> Ottilie, when Charlotte's secret was made known to her, bewildered by it, like Edward, and more than he, retired into herself she had nothing further to say: hope she could not, and wish she dared not."
119,108.wahlverwandtschaften_0902_librivox_64kb_mp3,1.18_131.flac,00018-f000143,-0.0700084,"Hoffen konnte sie nicht, und wünschen durfte sie nicht.","<MERGE> Ottilie, when Charlotte's secret was made known to her, bewildered by it, like Edward, and more than he, retired into herself she had nothing further to say: hope she could not, and wish she dared not."
120,108.wahlverwandtschaften_0902_librivox_64kb_mp3,1.18_132.flac,00018-f000144,0.756998,"Einen Blick jedoch in ihr Inneres gewährt uns ihr Tagebuch, aus dem wir einiges mitzuteilen gedenken.","A glimpse into what was passing in her we can gather from her diary, some passages of which we propose to communi cate before long."
