,book,DE_audio,EN_audio,score,DE_transcript,EN_transcript
0,18.undine_1503_librivox,00018-undine_0.flac,00018-f000001,0.694929,"Wenn ich euch erzählen sollte, wie es bei der Hochzeitfeier auf Burg Ringstetten zuging, so würde euch zumute werden, als sähet ihr eine Menge von blanken und erfreulichen Dingen aufgehäuft, aber drüberhin einen schwarzen Trauerflor gebreitet, aus dessen verdunkelnder Hülle hervor die ganze Herrlichkeit minder einer Lust gliche als einem Spott über die Nichtigkeit aller irdischen Freuden.","If I were to tell you how the marriagefeast passed at castle Ringstetten, it would seem to you as if you saw a heap of bright and pleasant things, but a gloomy veil of mourning spread over them all, the dark hue of which would make the splendor of the whole look less like happiness than a mockery of the emptiness of all earthly joys."
1,18.undine_1503_librivox,00018-undine_1.flac,00018-f000002,0.444567,"Es war nicht etwa, daß irgendein gespenstisches Unwesen die festliche Geselligkeit verstört hätte, denn wir wissen ja, daß die Burg vor den Spukereien der dräuenden Wassergeister eine gefeite Stätte war.","It was not that any spectral apparitions disturbed the festive company, for we know that the castle had been secured from the mischief of the threatening waterspirits."
2,18.undine_1503_librivox,00018-undine_2.flac,00018-f000003,1.05262,"Aber es war dem Ritter und dem Fischer und allen Gästen zumute, als fehle noch die Hauptperson bei dem Feste und als müsse diese Hauptperson die allgeliebte freundliche Undine sein.","But the knight and the fisherman and all the guests felt as if the chief personage were still lacking at the feast, and that this chief personage could be none other than the loved and gentle Undine."
3,18.undine_1503_librivox,00018-undine_3.flac,00018-f000004,0.686052,"Sooft eine Tür aufging, starrten aller Augen unwillkürlich dahin, und wenn es dann weiter nichts war als der Hausmeister mit neuen Schüsseln oder der Schenk mit einem Trunk noch edlern Weins, blickte man wieder trüb vor sich hin, und die Funken, die etwa hin und her von Scherz und Freude aufgeblitzt waren, erloschen in dem Tau wehmütigen Erinnerns.","Whenever a door opened, the eyes of all were involuntarily turned in that direction, and if it was nothing but the butler with new dishes, or the cupbearer with a flask of still richer wine, they would look down again sadly, and the flashes of wit and merriment which had passed to and fro, would be extinguished by sad remembrances."
4,18.undine_1503_librivox,00018-undine_4.flac,00018-f000005,0.558621,"Die Braut war von allen die leichtsinnigste und daher auch die vergnügteste; aber selbst ihr kam es bisweilen wunderlich vor, daß sie in dem grünen Kranze und den goldgestickten Kleidern an der Oberstelle der Tafel sitze, während Undine als Leichnam starr und kalt auf dem Grunde der Donau liege oder mit den Fluten forttreibe ins Weltmeer hinaus.","The bride was the most thoughtless of all, and therefore the most happy; but even to her it sometimes seemed strange that she should be sitting at the head of the table, wearing a green wreath and goldembroidered attire, while Undine was lying at the bottom of the Danube, a cold and stiff corpse, or floating away with the current into the mighty ocean."
5,18.undine_1503_librivox,00018-undine_5.flac,00018-f000006,0.606707,"Denn seit ihr Vater ähnliche Worte gesprochen hatte, klangen sie ihr immer vor den Ohren und wollten vorzüglich heute weder wanken noch weichen.","For, ever since her father had spoken of something of the sort, his words were ever ringing in her ear, and this day especially they were not inclined to give place to other thoughts."
6,18.undine_1503_librivox,00018-undine_6.flac,00018-f000007,0.318548,"Die Gesellschaft verlor sich bei kaum eingebrochner Nacht; nicht aufgelöst durch des Bräutigams hoffende Ungeduld, wie sonsten Hochzeitversammlungen, sondern nur ganz trüb und schwer auseinander gedrückt durch freudlose Schwermut und Unheil kündende Ahnungen.","The company dispersed early in the evening, not broken up by the bridegroom himself, but sadly and gloomily by the joyless mood of the guests and their forebodings of evil."
7,18.undine_1503_librivox,00018-undine_7.flac,00018-f000008,0.6451640000000001,"Bertalda ging mit ihren Frauen, der Ritter mit seinen Dienern, sich auszukleiden: von dem scherzend fröhlichen Geleit der Jungfrauen und Junggesellen bei Braut und Bräutigam war an diesem trüben Feste die Rede nicht.","Bertalda retired with her maidens, and the knight with his attendants; but at this mournful festival there was no gay, laughing train of bridesmaids and bridesmen."
8,18.undine_1503_librivox,00018-undine_8.flac,00018-f000009,0.76779,"Bertalda wollte sich aufheitern; sie ließ einen prächtigen Schmuck, den Huldbrand ihr geschenkt hatte, samt reichen Gewanden und Schleiern vor sich ausbreiten, ihren morgenden Anzug aufs schönste und heiterste daraus zu wählen.","Bertalda wished to arouse more cheerful thoughts; she ordered a splendid ornament of jewels which Huldbrand had given her, together with rich apparel and veils, to be spread out before her, in order that from these latter she might select the brightest and most beautiful for her morning attire."
9,18.undine_1503_librivox,00018-undine_9.flac,00018-f000010,0.595342,"Ihre Dienerinnen freueten sich des Anlasses, vieles und Fröhliches der jungen Herrin vorzusprechen, wobei sie nicht ermangelten, die Schönheit der Neuvermählten mit den lebhaftesten Worten zu preisen.","Her attendants were delighted at the opportunity of expressing their good wishes to their young mistress, not failing at the same time to extol the beauty of the bride in the most lively terms."
10,18.undine_1503_librivox,00018-undine_10.flac,00018-f000011,0.992727,"Man vertiefte sich mehr und mehr in diese Betrachtungen, bis endlich Bertalda, in einen Spiegel blickend, seufzte: Ach, aber seht ihr wohl die werdenden Sommersprossen hier seitwärts am Halse?","They were more and more absorbed in these considerations, till Bertalda at length, looking in a mirror, said with a sigh: Ah, but don't you see plainly how freckled I am growing here at the side of my neck?"
11,18.undine_1503_librivox,00018-undine_11.flac,00018-f000012,0.547697,"Sie sahen hin und fanden es freilich, wie es die schöne Herrin gesagt hatte, aber ein liebliches Mal nannten sie's, einen kleinen Flecken, der die Weiße der zarten Haut noch erhöhe.","They looked at her throat, and found the freckles as their fair mistress had said, but they called them beautyspots, and mere tiny blemishes only, tending to enhance the whiteness of her delicate skin."
12,18.undine_1503_librivox,00018-undine_12.flac,00018-f000013,0.746021,"Bertalda schüttelte den Kopf und meinte, ein Makel bleib es doch immer.",Bertalda shook her head and asserted that a spot was always a defect.
13,18.undine_1503_librivox,00018-undine_13.flac,00018-f000014,0.0605179,"Und ich könnt es los sein, seufzte sie endlich.","And I could remove them, she sighed a last, only the fountain is closed from which I used to have that precious and purifying water."
14,18.undine_1503_librivox,00018-undine_14.flac,00018-f000014,0.0605179,"Aber der Schloßbrunnen ist zu, aus dem ich sonst immer das köstliche, hautreinigende Wasser schöpfen ließ.","<MERGE> And I could remove them, she sighed a last, only the fountain is closed from which I used to have that precious and purifying water."
15,18.undine_1503_librivox,00018-undine_15.flac,00018-f000015,0.475862,Wenn ich doch heut nur eine Flasche davon hätte!,Oh! if I had but a flask of it today!
16,18.undine_1503_librivox,00018-undine_16.flac,00018-f000016,0.471429,Ist es nur das? lachte eine behende Dienerin und schlüpfte aus dem Gemach.,"Is that all? said an alert waitingmaid, laughing, as she slipped from the apartment."
17,18.undine_1503_librivox,00018-undine_17.flac,00018-f000017,0.680556,"Sie wird doch nicht so toll sein, fragte Bertalda wohlgefällig erstaunt, noch heut abend den Brunnenstein abwälzen zu lassen?","She will not be mad, exclaimed Bertalda, in a pleased and surprised tone, she will not be so mad as to have the stone removed from the fountain this very evening!"
18,18.undine_1503_librivox,00018-undine_18.flac,00018-f000018,0.984478,"Da hörte man bereits, daß Männer über den Hof gingen, und konnte aus dem Fenster sehn, wie die gefällige Dienerin sie grade auf den Brunnen losführte und sie Hebebäume und andres Werkzeug auf den Schultern trugen.","At the same moment they heard the men crossing the courtyard, and could see from the window how the officious waitingwoman was leading them straight up to the fountain, and that they were carrying levers and other instruments on their shoulders."
19,18.undine_1503_librivox,00018-undine_19.flac,00018-f000019,0.8928389999999999,"Es ist freilich mein Wille, lächelte Bertalda; wenn es nur nicht zu lange währt. wenn es nur nicht zu lange währt.","It is certainly my will, said Bertalda, smiling, if only it does not take too long."
20,18.undine_1503_librivox,00018-undine_20.flac,00018-f000020,0.782979,"Und froh im Gefühl, daß ein Wink von ihr jetzt vermöge, was ihr vormals so schmerzhaft geweigert worden war, schaute sie auf die Arbeit in den mondhellen Burghof hinab.","And, happy in the sense that a look from her now was able to effect what had formerly been so painfully refused her, she watched the progress of the work in the moonlit castlecourt."
21,18.undine_1503_librivox,00018-undine_21.flac,00018-f000021,0.7272529999999999,"Die Männer hoben mit Anstrengung an dem großen Steine; bisweilen seufzte wohl einer dabei, sich erinnernd, daß man hier der geliebten vorigen Herrin Werk zerstöre.","The men raised the enormous stone with an effort; now and then indeed one of their number would sigh, as he remembered that they were destroying the work of their former beloved mistress."
22,18.undine_1503_librivox,00018-undine_22.flac,00018-f000022,0.765455,Aber die Arbeit ging übrigens viel leichter als man gemeint hatte.,But the labor was far lighter than they had imagined.
23,18.undine_1503_librivox,00018-undine_23.flac,00018-f000023,0.691071,"Es war, als hülfe eine Kraft aus dem Brunnen heraus den Stein emporbringen.",It seemed as if a power within the spring itself were aiding them in raising the stone.
24,18.undine_1503_librivox,00018-undine_24.flac,00018-f000024,0.805816,"Es ist ja, sagten die Arbeiter erstaunt zueinander, als wäre das Wasser drinnen zum Springborne worden.","It is just, said the workmen to each other in astonishment, as if the water within had become a springing fountain."
25,18.undine_1503_librivox,00018-undine_25.flac,00018-f000025,0.750796,"Und mehr und mehr hob sich der Stein, und fast ohne Beistand der Werkleute rollte er langsam mit dumpfem Schallen auf das Pflaster hin.","And the stone rose higher and higher, and almost without the assistance of the workmen, it rolled slowly down upon the pavement with a hollow sound."
26,18.undine_1503_librivox,00018-undine_26.flac,00018-f000026,0.5304409999999999,"Aber aus des Brunnens Öffnung stieg es gleich einer weißen Wassersäule feierlich herauf; sie dachten erst, es würde mit dem Springbrunnen Ernst, bis sie gewahrten, daß die aufsteigende Gestalt ein bleiches, weißverschleiertes Weibsbild war.","But from the opening of the fountain there rose solemnly a white column of water; at first they imagined it had really become a springing fountain, till they perceived that the rising form was a pale female figure veiled in white."
27,18.undine_1503_librivox,00018-undine_27.flac,00018-f000027,0.669617,"Das weinte bitterlich, das hob die Hände ängstlich ringend über das Haupt und schritt mit langsam ernstem Gange nach dem Schloßgebäu.","She was weeping bitterly, raising her hands wailingly above her head and wringing them, as she walked with a slow and serious step to the castlebuilding."
28,18.undine_1503_librivox,00018-undine_28.flac,00018-f000028,0.183333,"Auseinander stob das Burggesind vom Brunnen fort, bleich stand,","The servants fled from the spring; the bride, pale and stiff with horror, stood at the window with her attendants."
29,18.undine_1503_librivox,00018-undine_29.flac,00018-f000028,0.183333,"Entsetzens starr, mit ihren Dienerinnen die Braut am Fenster.","<MERGE> The servants fled from the spring; the bride, pale and stiff with horror, stood at the window with her attendants."
30,18.undine_1503_librivox,00018-undine_30.flac,00018-f000029,0.721205,"Als die Gestalt nun dicht unter deren Kammern hinschritt, schaute sie winselnd nach ihr empor, und Bertalda meinte, unter dem Schleier Undinens bleiche Gesichtszüge zu erkennen.","When the figure had now come close beneath her room, it looked moaningly up to her, and Bertalda thought she could recognize beneath the veil the pale features of Undine."
31,18.undine_1503_librivox,00018-undine_31.flac,00018-f000030,0.266197,"Vorüber aber zog die Jammernde, schwer, gezwungen, zögernd, wie zum Hoch gericht.","But the sorrowing form passed on, sad, reluctant, and faltering, as if passing to execution."
32,18.undine_1503_librivox,00018-undine_32.flac,00018-f000031,0.8,"Bertalda schrie, man solle den Ritter rufen; es wagte sich keine der Zofen aus der Stelle, und auch die Braut selber verstummte wieder, wie vor ihrem eignen Laut erbebend.","Bertalda screamed out that the knight was to be called, but none of her maids ventured from the spot; and even the bride herself became mute, as if trembling at her own voice."
33,18.undine_1503_librivox,00018-undine_33.flac,00018-f000032,0.562837,"Während jene noch immer bang am Fenster standen, wie Bildsäulen regungslos, war die seltsame Wandrerin in die Burg gelangt, die wohlbekannten Treppen hinauf, die wohlbekannten Hallen durch, immer in ihren Tränen still.","While they were still standing fearfully at the window, motionless as statues, the strange wanderer had reached the castle, had passed up the wellknown stairs, and through the wellknown halls, ever in silent tears."
34,18.undine_1503_librivox,00018-undine_34.flac,00018-f000033,0.384,"Ach, wie so anders war sie einstens hier umgewandelt!.Der Ritter aber hatte seine Diener entlassen.",Alas! how differently had she once wandered through them!
35,18.undine_1503_librivox,00018-undine_35.flac,00018-f000034,0.309102,"Halbausgekleidet, im betrübten Sinnen, stand er vor einem großen Spiegel; die Kerze brannte dunkel neben ihm.","The knight, partly undressed, had already dismissed his attendants, and in a mood of deep dejection he was standing before a large mirror; a taper was burning dimly beside him."
36,18.undine_1503_librivox,00018-undine_36.flac,00018-f000035,0.155172,"Da klopfte es an die Tür mit leisem, leisem Finger.",There was a gentle tap at his door.
37,18.undine_1503_librivox,00018-undine_37.flac,00018-f000036,0.25846199999999997,"Undine hatte sonst wohl so geklopft, wenn sie ihn freundlich necken wollte.","Undine used to tap thus when she wanted playfully to tease him It is all fancy, said he to himself; I must seek my nuptial bed."
38,18.undine_1503_librivox,00018-undine_38.flac,00018-f000036,0.25846199999999997,Es ist alles nur Phantasterei! sagte er zu sich selbst.,"<MERGE> Undine used to tap thus when she wanted playfully to tease him It is all fancy, said he to himself; I must seek my nuptial bed."
39,18.undine_1503_librivox,00018-undine_39.flac,00018-f000037,0.154808,Ich muß ins Hochzeitbett.,"So you must, but it must be a cold one! he heard a tearful voice say from without, and then he saw in the mirror his door opening slowlyslowlyand the white figure entered, carefully closing it behind her."
40,18.undine_1503_librivox,00018-undine_40.flac,00018-f000037,0.154808,"Das mußt du, aber in ein kaltes! hörte er eine weinende Stimme draußen vor dem Gemache sagen, und dann sah er im Spiegel, wie die Tür aufging, langsam, langsam, und wie die weiße Wandrerin hereintrat und sittig das Schloß wieder hinter sich zudrückte.","<MERGE> So you must, but it must be a cold one! he heard a tearful voice say from without, and then he saw in the mirror his door opening slowlyslowlyand the white figure entered, carefully closing it behind her."
41,18.undine_1503_librivox,00018-undine_41.flac,00018-f000038,1.23731,"Sie haben den Brunnen aufgemacht, sagte sie leise, und nun bin ich hier, und nun mußt du sterben.","They have opened the spring, said she softly, and now I am here, and you must die."
42,18.undine_1503_librivox,00018-undine_42.flac,00018-f000039,0.7780130000000001,"Er fühlte in seinem stockenden Herzen, daß es auch gar nicht anders sein könne, deckte aber die Hände über die Augen und sagte: Mache mich nicht in meiner Todesstunde durch Schrecken toll.","He felt in his paralyzed heart that it could not be otherwise, but covering his eyes with his hands he said: Do not make me mad with terror in my hour of death."
43,18.undine_1503_librivox,00018-undine_43.flac,00018-f000040,0.761308,"Wenn du ein entsetzliches Antlitz hinter dem Schleier trägst, so lüfte ihn nicht, und richte mich, ohne daß ich dich schaue.","If you wear a hideous face behind that veil, do not raise it, but take my life, and let me see you not."
44,18.undine_1503_librivox,00018-undine_44.flac,00018-f000041,0.428571,"Ach, entgegnete die Wandrerin, willst du mich denn nicht noch ein einziges Mal sehn?","Alas! replied the figure, will you then not look upon me once more?"
45,18.undine_1503_librivox,00018-undine_45.flac,00018-f000041,0.949451,"Ich bin schön, wie als du auf der Seespitze um mich warbst.","Alas! replied the figure, will you then not look upon me once more?"
46,18.undine_1503_librivox,00018-undine_46.flac,00018-f000042,0.925275,"O, wenn das wäre! seufzte Huldbrand; und wenn ich sterben dürfte an einem Kusse von dir. und wenn ich sterben dürfte an einem Kusse von dir.",I am as fair as when you wooed me on the promontory.
47,18.undine_1503_librivox,00018-undine_47.flac,00018-f000044,0.263808,"Recht gern, mein Liebling, sagte sie.","Most gladly, my loved one, said she; and throwing her veil back, her lovely face smiled forth divinely beautiful."
48,18.undine_1503_librivox,00018-undine_48.flac,00018-f000044,0.640116,"Und ihre Schleier schlug sie zurück, und himmlisch schön lächelte ihr holdes Antlitz daraus hervor.","Most gladly, my loved one, said she; and throwing her veil back, her lovely face smiled forth divinely beautiful."
49,18.undine_1503_librivox,00018-undine_49.flac,00018-f000045,0.629405,"Bebend vor Liebe und Todesnähe neigte sich der Ritter ihr entgegen, sie küßte ihn mit einem himmlischen Kusse, aber sie ließ ihn nicht mehr los, sie drückte ihn inniger an sich und weinte, als wolle sie ihre Seele fortweinen.","Trembling with love and with the approach of death, she kissed him with a holy kiss; but not relaxing her hold she pressed him fervently to her, and as if she would weep away her soul."
50,18.undine_1503_librivox,00018-undine_50.flac,00018-f000046,0.530138,"Die Tränen drangen in des Ritter Augen und wogten im lieblichen Wehe durch seine Brust, bis ihm endlich der Atem entging und er aus den schönen Armen als ein Leichnam sanft auf die Kissen des Ruhebettes zurücksank.","Tears rushed into the knight's eyes, and seemed to surge through his heaving breast, till at length his breathing ceased, and he fell softly back from the beautiful arms of Undine, upon the pillows of his coucha corpse."
51,18.undine_1503_librivox,00018-undine_51.flac,00018-f000047,0.851239,"Ich habe ihn totgeweint! sagte sie zu einigen Dienern, die ihr im Vorzimmer begegneten, und schritt durch die Mitte der Erschreckten langsam nach dem Brunnen hinaus.","I have wept him to death, said she to some servants who met her in the antechamber; and, passing through the affrighted group, she went slowly out toward the fountain."
