,book,DE_audio,EN_audio,score,DE_transcript,EN_transcript
68,18.undine_1503_librivox,00014-undine_68.flac,00014-f000064,0.9375,"Der Ritter fühlte den Sinn dieser Reden weit mehr, als daß er auf die Bedeutung der Worte achtgegeben hätte, und antwortete auch einzig auf jenen.","The knight felt the sense of her words far more than he regarded their meaning, and it was the sense alone to which he replied."
69,18.undine_1503_librivox,00014-undine_69.flac,00014-f000065,0.115823,"Da rief der Fuhrmann plötzlich mit kreischender Stimme: Hoch, ihr Schimmel!","Presently the wagoner suddenly shouted with loud voice, Up, my grays, up with your feet, keep together! remember who you are!"
70,18.undine_1503_librivox,00014-undine_70.flac,00014-f000065,0.115823,Hoch den Fuß!,"<MERGE> Presently the wagoner suddenly shouted with loud voice, Up, my grays, up with your feet, keep together! remember who you are!"
71,18.undine_1503_librivox,00014-undine_71.flac,00014-f000065,0.115823,"Nehmt euch zusammen, Schimmel!","<MERGE> Presently the wagoner suddenly shouted with loud voice, Up, my grays, up with your feet, keep together! remember who you are!"
72,18.undine_1503_librivox,00014-undine_72.flac,00014-f000066,0.14449,"Denkt hübsch, was ihr seid!","The knight leaned out of the wagon and saw that the horses were stepping into the midst of a foaming stream or were already almost swimming, while the wheels of the wagon were rushing round and gleaming like millwheels, and the wagoner had jot up in front, in consequence of the increasing waters."
73,18.undine_1503_librivox,00014-undine_73.flac,00014-f000066,0.14449,"Der Ritter beugte sich aus dem Wagen und sah, wie die Pferde mitten im schäumenden Wasser dahinschritten oder fast schon schwammen, des Wagens Räder wie Mühlenräder blinkten und rauschten, der Kärrner vor der wachsenden Flut auf das Fuhrwerk gestiegen war.","<MERGE> The knight leaned out of the wagon and saw that the horses were stepping into the midst of a foaming stream or were already almost swimming, while the wheels of the wagon were rushing round and gleaming like millwheels, and the wagoner had jot up in front, in consequence of the increasing waters."
74,18.undine_1503_librivox,00014-undine_74.flac,00014-f000067,1.02391,Was soll das für ein Weg sein?,What sort of a road is this?
75,18.undine_1503_librivox,00014-undine_75.flac,00014-f000068,0.750629,Der geht ja mitten in den Strom! rief Huldbrand seinem Führer zu.,It goes into the middle of the stream. cried Huldbrand to his guide.
76,18.undine_1503_librivox,00014-undine_76.flac,00014-f000069,-0.0333333,"Nein, Herr, lachte dieser zurück; es ist grad umgekehrt.","Not at all, sir. returned the other, laughing, it is just the reverse, the stream goes into the very middle of our road."
77,18.undine_1503_librivox,00014-undine_77.flac,00014-f000069,-0.0333333,Der Strom geht mitten in unsern Weg.,"<MERGE> Not at all, sir. returned the other, laughing, it is just the reverse, the stream goes into the very middle of our road."
78,18.undine_1503_librivox,00014-undine_78.flac,00014-f000070,0.0925595,"Seht Euch nur um, wie alles übergetreten ist.","Look round and see how everything is covered by the water The whole valley indeed was suddenly filled with the surging flood, that visibly increased."
79,18.undine_1503_librivox,00014-undine_79.flac,00014-f000070,0.0925595,"In der Tat wogte und rauschte der ganze Talgrund von plötzlich empörten, sichtbar steigenden Wellen.","<MERGE> Look round and see how everything is covered by the water The whole valley indeed was suddenly filled with the surging flood, that visibly increased."
80,18.undine_1503_librivox,00014-undine_80.flac,00014-f000071,0.291429,"Das ist der Kühleborn, der böse Wassernix, der uns ersäufen will! rief der Ritter.","It is Kuhleborn, the evil waterspirit, who wishes to drown us! exclaimed the knight."
81,18.undine_1503_librivox,00014-undine_81.flac,00014-f000072,0.658333,"Weißt du kein Sprüchlein wider ihn, Gesell?","Have you no charm, against him, my friend?"
82,18.undine_1503_librivox,00014-undine_82.flac,00014-f000073,0.892174,"Ich wüßte wohl eins, sagte der Fuhrmann, aber ich kann und mag es nicht eher brauchen, als bis Ihr wißt, wer ich bin.","I know indeed of one, returned the wagoner, but I cannot and may not use it until you know who I am."
83,18.undine_1503_librivox,00014-undine_83.flac,00014-f000074,0.5842109999999999,Ist es hier Zeit zu Rätseln? schrie der Ritter.,Is this a time for riddles? cried the knight.
84,18.undine_1503_librivox,00014-undine_84.flac,00014-f000075,0.8103640000000001,"Die Flut steigt immer höher, und was geht es mich an, zu wissen, wer du bist?","The flood is ever rising higher, and what does it matter to me to know who you are?"
85,18.undine_1503_librivox,00014-undine_85.flac,00014-f000076,0.702256,"Es geht Euch aber doch was an, sagte der Fuhrmann, denn ich bin Kühleborn.","It does matter to you, though, said the wagoner, for I am Kuhleborn."
86,18.undine_1503_librivox,00014-undine_86.flac,00014-f000077,0.6825399999999999,"Damit lachte er, verzerrten Antlitzes, zum Wagen herein, aber der Wagen blieb nicht Wagen mehr, die Schimmel nicht Schimmel; alles verschäumte, verrann in zischenden Wogen, und selbst der Fuhrmann bäumte sich als eine riesige Welle empor, riß den vergeblich arbeitenden Hengst unter die Gewässer hinab und wuchs dann wieder, und wuchs über den Häuptern des schwimmenden Paares wie zu einem feuchten Turme an und wollte sie eben rettungslos begraben.","So saying, he thrust his distorted face into the wagon with a grin, but the wagon was a wagon no longer, the horses were not horsesall was transformed to foam and vanished in the hissing waves, and even the wagoner himself, rising as a gigantic billow, drew down the vainly struggling horse beneath the waters, and then swelling higher and higher, swept over the heads of the floating pair, like some liquid tower, threatening to bury them irrecoverably."
87,18.undine_1503_librivox,00014-undine_87.flac,00014-f000078,0.611733,"Da scholl Undinens anmutige Stimme durch das Getöse hin, der Mond trat aus den Wolken, und mit ihm ward Undine auf den Höhen des Talgrundes sichtbar.","Just then the soft voice of Undine sounded through the uproar, the moon emerged from the clouds, and by its light Undine was seen on the heights above the valley."
88,18.undine_1503_librivox,00014-undine_88.flac,00014-f000079,0.728571,"Sie schalt, sie drohte in die Fluten hinab, die drohende Turmeswoge verschwand murrend und murmelnd, leise rannen die Wasser im Mondglanze dahin, und wie eine weiße Taube sah man Undinen von der Höhe hinabtauchen, den Ritter und Bertalden erfassen und mit sich nach einem frischen, grünen Rasenfleck auf der Höhe emporheben, wo sie mit ausgesuchten Labungen Ohnmacht und Schrecken vertrieb; dann half sie Bertalden zu dem weißen Zelter, der sie selbst hergetragen hatte, hinaufheben, und so gelangten alle dreie nach Burg Ringstetten zurück.","She rebuked, she threatened the floods below; the menacing, towerlike wave vanished, muttering and murmuring, the waters flowed gently away in the moonlight, and like a white dove, Undine flew down from the height, seized the knight and Bertalda, and bore them with her to a fresh, green, turfy spot on the hill, where with choice refreshing restoratives, she dispelled their terrors and weariness; then she assisted Bertalda to mount the white palfrey, on which she had herself ridden here, and thus all three returned back to castle Ringstetten."
