f000205,1637.320,1640.680,"Actually just yesterday evening I had a small premonition."
f000206,1640.680,1643.400,"People must have seen that in me."
f000207,1643.400,1647.240,"Why have I not reported that to the office?"
f000208,1647.240,1652.440,"But people always think that they'll get over sickness without having to stay at home."
f000209,1652.440,1654.240,"Mr. Manager!"
f000210,1654.240,1656.760,"Take it easy on my parents!"
f000211,1656.760,1664.360,"There is really no basis for the criticisms which you're now making against me, and really nobody has said a word to me about that."
f000212,1664.360,1668.160,"Perhaps you have not read the latest orders which I shipped."
f000213,1668.160,1677.160,"Besides, now I'm setting out on my trip on the eight o'clock train; the few hours' rest have made me stronger."
f000214,1677.160,1680.160,"Mr. Manager, do not stay."
f000215,1680.160,1683.200,"I will be at the office in person right away."
f000216,1683.200,1688.720,"Please have the goodness to say that and to convey my respects to the Chief."
f000217,1688.720,1707.120,"While Gregor was quickly blurting all this out, hardly aware of what he was saying, he had moved close to the chest of drawers without effort, probably as a result of the practice he had already had in bed, and now he was trying to raise himself up on it."
f000218,1707.120,1710.000,"Actually, he wanted to open the door."
f000219,1710.000,1716.120,"He really wanted to let himself be seen by and to speak with the manager."
f000220,1716.120,1722.520,"He was keen to witness what the others now asking about him would say when they saw him."
f000221,1722.520,1728.720,"If they were startled, then Gregor had no more responsibility and could be calm."
f000222,1728.720,1742.280,"But if they accepted everything quietly, then he would have no reason to get excited and, if he got a move on, could really be at the station around eight o'clock."
f000223,1742.280,1746.840,"At first he slid down a few times on the smooth chest of drawers."
f000224,1746.840,1752.360,"But at last he gave himself a final swing and stood upright there."
f000225,1752.360,1759.560,"He was no longer at all aware of the pains in his lower body, no matter how they might still sting."
f000226,1759.560,1768.440,"Now he let himself fall against the back of a nearby chair, on the edge of which he braced himself with his thin limbs."
f000227,1768.440,1775.960,"By doing this he gained control over himself and kept quiet, for he could now hear the manager."
f000228,1775.960,1784.240,"Did you understood a single word? the manager asked the parents, Is he playing the fool with us?"
f000229,1784.240,1791.640,"For God's sake, cried the mother already in tears, perhaps he's very ill and we're upsetting him."
f000230,1791.640,1792.720,"Grete!"
f000231,1792.720,1794.800,"Grete! she yelled at that point."
f000232,1794.800,1798.200,"Mother? called the sister from the other side."
f000233,1798.200,1802.120,"They were making themselves understood through Gregor's room."
f000234,1802.120,1804.880,"You must go to the doctor right away."
f000235,1804.880,1806.240,"Gregor is sick."
f000236,1806.240,1807.760,"Hurry to the doctor."
f000237,1807.760,1809.840,"Have you heard Gregor speak yet?"
f000238,1809.840,1818.480,"That was an animal's voice, said the manager, remarkably quietly in comparison to the mother's cries."
f000239,1818.480,1819.920,"Anna!"
f000240,1819.920,1826.560,"Anna!' yelled the father through the hall into the kitchen, clapping his hands, fetch a locksmith right away!"
f000241,1826.560,1837.560,"The two young women were already running through the hall with swishing skirts—how had his sister dressed herself so quickly?—and yanked open the doors of the apartment."
f000242,1837.560,1840.240,"One couldn't hear the doors closing at all."
f000243,1840.240,1847.120,"They probably had left them open, as is customary in an apartment where a huge misfortune has taken place."
f000244,1847.120,1851.960,"However, Gregor had become much calmer."
f000245,1851.960,1864.320,"All right, people did not understand his words any more, although they seemed clear enough to him, clearer than previously, perhaps because his ears had gotten used to them."
f000246,1864.320,1871.240,"But at least people now thought that things were not all right with him and were prepared to help him."
f000247,1871.240,1878.520,"The confidence and assurance with which the first arrangements had been carried out made him feel good."
f000248,1878.520,1895.320,"He felt himself included once again in the circle of humanity and was expecting from both the doctor and the locksmith, without differentiating between them with any real precision, splendid and surprising results."
f000249,1895.320,1914.720,"In order to get as clear a voice as possible for the critical conversation which was imminent, he coughed a little, and certainly took the trouble to do this in a really subdued way, since it was possible that even this noise sounded like something different from a human cough."
f000250,1914.720,1918.840,"He no longer trusted himself to decide any more."
f000251,1918.840,1923.160,"Meanwhile in the next room it had become really quiet."
f000252,1923.160,1931.640,"Perhaps his parents were sitting with the manager at the table whispering; perhaps they were all leaning against the door listening."
f000253,1931.640,1954.120,"Gregor pushed himself slowly towards the door, with the help of the easy chair, let go of it there, threw himself against the door, held himself upright against it—the balls of his tiny limbs had a little sticky stuff on them—and rested there momentarily from his exertion."
f000254,1954.120,1959.840,"Then he made an effort to turn the key in the lock with his mouth."
f000255,1959.840,1964.360,"Unfortunately it seemed that he had no real teeth."
f000256,1964.360,1967.920,"How then was he to grab hold of the key?"
f000257,1967.920,1977.040,"But to make up for that his jaws were naturally very strong; with their help he managed to get the key really moving."
f000258,1977.040,1989.480,"He didn't notice that he was obviously inflicting some damage on himself, for a brown fluid came out of his mouth, flowed over the key, and dripped onto the floor."
f000259,1989.480,1995.280,"Just listen for a moment, said the manager in the next room; he's turning the key."
f000260,1995.280,1999.400,"For Gregor that was a great encouragement."
f000261,1999.400,2010.320,"But they all should've called out to him, including his father and mother, Come on, Gregor, they should've shouted; keep going, keep working on the lock."
f000262,2010.320,2019.600,"Imagining that all his efforts were being followed with suspense, he bit down frantically on the key with all the force he could muster."
f000263,2019.600,2025.040,"As the key turned more, he danced around the lock."
f000264,2025.040,2036.040,"Now he was holding himself upright only with his mouth, and he had to hang onto the key or then press it down again with the whole weight of his body, as necessary."
f000265,2036.040,2043.160,"The quite distinct click of the lock as it finally snapped really woke Gregor up."
f000266,2043.160,2054.120,"Breathing heavily he said to himself, So I didn't need the locksmith, and he set his head against the door handle to open the door completely."
f000267,2054.120,2064.080,"Because he had to open the door in this way, it was already open very wide without him yet being really visible."
f000268,2064.080,2075.600,"He first had to turn himself slowly around the edge of the door, very carefully, of course, if he didn't want to fall awkwardly on his back right at the entrance into the room."
f000269,2075.600,2102.160,"He was still preoccupied with this difficult movement and had no time to pay attention to anything else, when he heard the manager exclaim a loud Oh!—it sounded like the wind whistling—and now he saw him, nearest to the door, pressing his hand against his open mouth and moving slowly back, as if an invisible constant force was pushing him away."
f000270,2102.160,2116.240,"His mother—in spite of the presence of the manager she was standing here with her hair sticking up on end, still a mess from the night—was looking at his father with her hands clasped."
f000271,2116.240,2129.200,"She then went two steps towards Gregor and collapsed right in the middle of her skirts, which were spread out all around her, her face sunk on her breast, completely concealed."
f000272,2129.200,2146.800,"His father clenched his fist with a hostile expression, as if he wished to push Gregor back into his room, then looked uncertainly around the living room, covered his eyes with his hands, and cried so that his mighty breast shook."
f000273,2146.800,2167.600,"At this point Gregor did not take one step into the room, but leaned his body from the inside against the firmly bolted wing of the door, so that only half his body was visible, as well as his head, tilted sideways, with which he peeped over at the others."
f000274,2167.600,2170.840,"Meanwhile it had become much brighter."
f000275,2170.840,2185.320,"Standing out clearly from the other side of the street was a part of the endless greyblack house situated opposite—it was a hospital—with its severe regular windows breaking up the facade."
f000276,2185.320,2196.640,"The rain was still coming down, but only in large individual drops visibly and firmly thrown down one by one onto the ground."
f000277,2196.640,2211.600,"The breakfast dishes were standing piled around on the table, because for his father breakfast was the most important meal time in the day, which he prolonged for hours by reading various newspapers."
f000278,2211.600,2231.160,"Directly across on the opposite wall hung a photograph of Gregor from the time of his military service; it was a picture of him as a lieutenant, as he, smiling and worry free, with his hand on his sword, demanded respect for his bearing and uniform."
f000279,2231.160,2244.200,"The door to the hall was ajar, and since the door to the apartment was also open, one could see out into the landing of the apartment and the start of the staircase going down."
f000280,2244.200,2251.360,"Now, said Gregor, well aware that he was the only one who had kept his composure."
f000281,2251.360,2257.440,"I'll get dressed right away, pack up the collection of samples, and set off."
f000282,2257.440,2260.680,"You'll allow me to set out on my way, will you not?"
f000283,2260.680,2266.160,"You see, Mr. Manager, I am not pigheaded, and I am happy to work."
f000284,2266.160,2270.480,"Travelling is exhausting, but I couldn't live without it."
f000285,2270.480,2273.000,"Where are you going, Mr. Manager?"
f000286,2273.000,2274.080,"To the office?"
f000287,2274.080,2274.480,"Really?"
f000288,2274.480,2276.880,"Will you report everything truthfully?"
f000289,2276.880,2295.000,"A person can be incapable of work momentarily, but that's precisely the best time to remember the earlier achievements and to consider that later, after the obstacles have been shoved aside, the person will work all the more eagerly and intensely."
f000290,2295.000,2300.240,"I am really so indebted to Mr. Chiefyou know that perfectly well."
f000291,2300.240,2304.720,"On the other hand, I am concerned about my parents and my sister."
f000292,2304.720,2309.320,"I'm in a fix, but I'll work myself out of it again."
f000293,2309.320,2313.200,"Don't make things more difficult for me than they already are."
f000294,2313.200,2316.280,"Speak up on my behalf in the office!"
f000295,2316.280,2319.600,"People don't like travelling salesmen."
f000296,2319.600,2320.760,"I know that."
f000297,2320.760,2325.040,"People think they earn pots of money and thus lead a fine life."
f000298,2325.040,2329.840,"People don't even have any special reason to think through this judgment more clearly."
f000299,2329.840,2350.200,"But you, Mr. Manager, you have a better perspective on what's involved than other people, even, I tell you in total confidence, a better perspective than Mr. Chairman himself, who in his capacity as the employer may let his judgment make casual mistakes at the expense of an employee."
f000300,2350.200,2386.120,"You also know well enough that the travelling salesman who is outside the office almost the entire year can become so easily a victim of gossip, coincidences, and groundless complaints, against which it's impossible for him to defend himself, since for the most part he doesn't hear about them at all and only then when he's exhausted after finishing a trip and at home gets to feel in his own body the nasty consequences, which can't be thoroughly explored back to their origins."
f000301,2386.120,2394.080,"Mr. Manager, don't leave without speaking a word telling me that you'll at least concede that I'm a little in the right!"
f000302,2394.080,2406.600,"But at Gregor's first words the manager had already turned away, and now he looked back at Gregor over his twitching shoulders with pursed lips."
f000303,2406.600,2421.560,"During Gregor's speech he was not still for a moment but kept moving away towards the door, without taking his eyes off Gregor, but really gradually, as if there was a secret ban on leaving the room."
f000304,2421.560,2432.760,"He was already in the hall, and given the sudden movement with which he finally pulled his foot out of the living room, one could have believed that he had just burned the sole of his foot."
f000305,2432.760,2445.160,"In the hall, however, he stretched his right hand out away from his body towards the staircase, as if some truly supernatural relief was waiting for him there."
f000306,2445.160,2461.160,"Gregor realized that he must not under any circumstances allow the manager to go away in this frame of mind, especially if his position in the firm was not to be placed in the greatest danger."
f000307,2461.160,2465.080,"His parents did not understand all this very well."
f000308,2465.080,2480.040,"Over the long years, they had developed the conviction that Gregor was set up for life in his firm and, in addition, they had so much to do nowadays with their present troubles that all foresight was foreign to them."
f000309,2480.040,2483.080,"But Gregor had this foresight."
f000310,2483.080,2489.240,"The manager must be held back, calmed down, convinced, and finally won over."
f000311,2489.240,2493.560,"The future of Gregor and his family really depended on it!"
f000312,2493.560,2496.240,"If only the sister had been there!"
f000313,2496.240,2497.560,"She was clever."
f000314,2497.560,2502.400,"She had already cried while Gregor was still lying quietly on his back."
f000315,2502.400,2508.920,"And the manager, this friend of the ladies, would certainly let himself be guided by her."
f000316,2508.920,2515.080,"She would have closed the door to the apartment and talked him out of his fright in the hall."
f000317,2515.080,2518.040,"But the sister was not even there."
f000318,2518.040,2521.240,"Gregor must deal with it himself."
f000319,2521.240,2548.200,"Without thinking that as yet he didn't know anything about his present ability to move and that his speech possibly—indeed probably—had once again not been understood, he left the wing of the door, pushed himself through the opening, and wanted to go over to the manager, who was already holding tight onto the handrail with both hands on the landing in a ridiculous way."
f000320,2548.200,2557.600,"But as he looked for something to hold onto, with a small scream Gregor immediately fell down onto his numerous little legs."
f000321,2557.600,2565.160,"Scarcely had this happened, when he felt for the first time that morning a general physical well being."
f000322,2565.160,2577.520,"The small limbs had firm floor under them; they obeyed perfectly, as he noticed to his joy, and strove to carry him forward in the direction he wanted."
f000323,2577.520,2585.000,"Right away he believed that the final amelioration of all his suffering was immediately at hand."
f000324,2585.000,2608.160,"But at the very moment when he lay on the floor rocking in a restrained manner quite close and directly across from his mother, who had apparently totally sunk into herself, she suddenly sprang right up with her arms spread far apart and her fingers extended and cried out, Help, for God's sake, help!"
f000325,2608.160,2622.640,"She held her head bowed down, as if she wanted to view Gregor better, but ran senselessly back, contradicting that gesture, forgetting that behind her stood the table with all the dishes on it."
f000326,2622.640,2638.640,"When she reached the table, she sat down heavily on it, as if absentmindedly, and did not appear to notice at all that next to her coffee was pouring out onto the carpet in a full stream from the large overturned container."
f000327,2638.640,2645.120,"Mother, mother, said Gregor quietly, and looked over towards her."
f000328,2645.120,2650.120,"The manager momentarily had disappeared completely from his mind."
f000329,2650.120,2658.360,"At the sight of the flowing coffee Gregor couldn't stop himself snapping his jaws in the air a few times."
f000330,2658.360,2669.080,"At that his mother screamed all over again, hurried from the table, and collapsed into the arms of his father, who was rushing towards her."
f000331,2669.080,2676.120,"But Gregor had no time right now for his parents—the manager was already on the staircase."
f000332,2676.120,2681.360,"His chin level with the banister, the manager looked back for the last time."
f000333,2681.360,2686.200,"Gregor took an initial movement to catch up to him if possible."
f000334,2686.200,2695.120,"But the manager must have suspected something, because he made a leap down over a few stairs and disappeared, still shouting Huh!"
f000335,2695.120,2698.960,"The sound echoed throughout the entire stairwell."
f000336,2698.960,2707.400,"Now, unfortunately this flight of the manager also seemed to bewilder his father completely."
f000337,2707.400,2724.680,"Earlier he had been relatively calm, for instead of running after the manager himself or at least not hindering Gregor from his pursuit, with his right hand he grabbed hold of the manager's cane, which he had left behind with his hat and overcoat on a chair."
f000338,2724.680,2738.320,"With his left hand, his father picked up a large newspaper from the table and, stamping his feet on the floor, he set out to drive Gregor back into his room by waving the cane and the newspaper."
f000339,2738.320,2744.840,"No request of Gregor's was of any use; no request would even be understood."
f000340,2744.840,2753.120,"No matter how willing he was to turn his head respectfully, his father just stomped all the harder with his feet."
f000341,2753.120,2766.040,"Across the room from him his mother had pulled open a window, in spite of the cool weather, and leaning out with her hands on her cheeks, she pushed her face far outside the window."
f000342,2766.040,2780.160,"Between the alley and the stairwell a strong draught came up, the curtains on the window flew around, the newspapers on the table swished, and individual sheets fluttered down over the floor."
f000343,2780.160,2787.040,"The father relentlessly pressed forward, pushing out sibilants, like a wild man."
f000344,2787.040,2793.880,"Now, Gregor had no practice at all in going backwards—it was really very slow going."
f000345,2793.880,2813.800,"If Gregor only had been allowed to turn himself around, he would have been in his room right away, but he was afraid to make his father impatient by the timeconsuming process of turning around, and each moment he faced the threat of a mortal blow on his back or his head from the cane in his father's hand."
f000346,2813.800,2824.880,"Finally Gregor had no other option, for he noticed with horror that he did not understand yet how to maintain his direction going backwards."
f000347,2824.880,2838.760,"And so he began, amid constantly anxious sideways glances in his father's direction, to turn himself around as quickly as possible, although in truth this was only done very slowly."
f000348,2838.760,2853.320,"Perhaps his father noticed his good intentions, for he did not disrupt Gregor in this motion, but with the tip of the cane from a distance he even directed Gregor's rotating movement here and there."
f000349,2853.320,2858.680,"If only his father had not hissed so unbearably!"
f000350,2858.680,2862.880,"Because of that Gregor totally lost his head."
f000351,2862.880,2873.640,"He was already almost totally turned around, when, always with this hissing in his ear, he just made a mistake and turned himself back a little."
f000352,2873.640,2883.960,"But when he finally was successful in getting his head in front of the door opening, it became clear that his body was too wide to go through any further."
f000353,2883.960,2895.800,"Naturally his father, in his present mental state, had no idea of opening the other wing of the door a bit to create a suitable passage for Gregor to get through."
f000354,2895.800,2902.640,"His single fixed thought was that Gregor must get into his room as quickly as possible."
f000355,2902.640,2911.320,"He would never have allowed the elaborate preparations that Gregor required to orient himself and thus perhaps get through the door."
f000356,2911.320,2919.280,"On the contrary, as if there were no obstacle and with a peculiar noise, he now drove Gregor forwards."
f000357,2919.280,2925.800,"Behind Gregor the sound at this point was no longer like the voice of only a single father."
f000358,2925.800,2933.000,"Now it was really no longer a joke, and Gregor forced himself, come what might, into the door."
f000359,2933.000,2936.120,"One side of his body was lifted up."
f000360,2936.120,2939.200,"He lay at an angle in the door opening."
f000361,2939.200,2942.480,"His one flank was sore with the scraping."
f000362,2942.480,2946.840,"On the white door ugly blotches were left."
f000363,2946.840,2952.440,"Soon he was stuck fast and would have not been able to move any more on his own."
f000364,2952.440,2961.520,"The tiny legs on one side hung twitching in the air above, and the ones on the other side were pushed painfully into the floor."
f000365,2961.520,2974.160,"Then his father gave him one really strong liberating push from behind, and he scurried, bleeding severely, far into the interior of his room."
f000366,2974.160,2980.080,"The door was slammed shut with the cane, and finally it was quiet."
f000367,2980.080,2983.840,"end of section one."