f000001,29.560,31.480,"One."
f000002,31.480,44.920,"One morning, as Gregor Samsa was waking up from anxious dreams, he discovered that in bed he had been changed into a monstrous verminous bug."
f000003,44.920,58.680,"He lay on his armourhard back and saw, as he lifted his head up a little, his brown, arched abdomen divided up into rigid bowlike sections."
f000004,58.680,66.960,"From this height the blanket, just about ready to slide off completely, could hardly stay in place."
f000005,66.960,78.240,"His numerous legs, pitifully thin in comparison to the rest of his circumference, flickered helplessly before his eyes."
f000006,78.240,81.760,"What's happened to me, he thought."
f000007,81.760,83.800,"It was no dream."
f000008,83.800,93.960,"His room, a proper room for a human being, only somewhat too small, lay quietly between the four wellknown walls."
f000009,93.960,110.920,"Above the table, on which an unpacked collection of sample cloth goods was spread out—Samsa was a travelling salesman—hung the picture which he had cut out of an illustrated magazine a little while ago and set in a pretty gilt frame."
f000010,110.920,115.600,"It was a picture of a woman with a fur hat and a fur boa."
f000011,115.600,126.680,"She sat erect there, lifting up in the direction of the viewer a solid fur muff into which her entire forearm had disappeared."
f000012,126.680,130.160,"Gregor's glance then turned to the window."
f000013,130.160,139.520,"The dreary weather—the rain drops were falling audibly down on the metal window ledge—made him quite melancholy."
f000014,139.520,146.840,"Why don't I keep sleeping for a little while longer and forget all this foolishness, he thought."
f000015,146.840,158.160,"But this was entirely impractical, for he was used to sleeping on his right side, and in his present state he couldn't get himself into this position."
f000016,158.160,165.440,"No matter how hard he threw himself onto his right side, he always rolled again onto his back."
f000017,165.440,181.000,"He must have tried it a hundred times, closing his eyes so that he would not have to see the wriggling legs, and gave up only when he began to feel a light, dull pain in his side which he had never felt before."
f000018,181.000,186.640,"O God, he thought, what a demanding job I've chosen!"
f000019,186.640,190.000,"Day in, day out, on the road."
f000020,190.000,210.160,"The stresses of selling are much greater than the work going on at head office, and, in addition to that, I have to cope with the problems of travelling, the worries about train connections, irregular bad food, temporary and constantly changing human relationships, which never come from the heart."
f000021,210.160,214.040,"To hell with it all!"
f000022,214.040,218.480,"He felt a slight itching on the top of his abdomen."
f000023,218.480,236.440,"He slowly pushed himself on his back closer to the bed post so that he could lift his head more easily, found the itchy part, which was entirely covered with small white spots—he did not know what to make of them and wanted to feel the place with a leg."
f000024,236.440,244.080,"But he retracted it immediately, for the contact felt like a cold shower all over him."
f000025,244.080,249.120,"He slid back again into his earlier position."
f000026,249.120,254.760,"This getting up early, he thought, makes a man quite idiotic."
f000027,254.760,257.960,"A man must have his sleep."
f000028,257.960,261.960,"Other travelling salesmen live like harem women."
f000029,261.960,271.880,"For instance, when I come back to the inn during the course of the morning to write up the necessary orders, these gentlemen are just sitting down to breakfast."
f000030,271.880,276.600,"If I were to try that with my boss, I'd be thrown out on the spot."
f000031,276.600,281.520,"Still, who knows whether that mightn't be really good for me?"
f000032,281.520,286.320,"If I didn't hold back for my parents' sake, I'd have quit ages ago."
f000033,286.320,292.200,"I would've gone to the boss and told him just what I think from the bottom of my heart."
f000034,292.200,295.080,"He would've fallen right off his desk!"
f000035,295.080,302.080,"How weird it is to sit up at that desk and talk down to the employee from way up there."
f000036,302.080,308.480,"The boss has trouble hearing, so the employee has to step up quite close to him."
f000037,308.480,312.520,"Anyway, I haven't completely given up that hope yet."
f000038,312.520,322.640,"Once I've got together the money to pay off my parents' debt to him—that should take another five or six years—I'll do it for sure."
f000039,322.640,325.040,"Then I'll make the big break."
f000040,325.040,328.720,"In any case, right now I have to get up."
f000041,328.720,332.320,"My train leaves at five o'clock."
f000042,332.320,337.600,"He looked over at the alarm clock ticking away by the chest of drawers."
f000043,337.600,339.760,"Good God! he thought."
f000044,339.760,344.720,"It was half past six, and the hands were going quietly on."
f000045,344.720,348.480,"It was past the half hour, already nearly quarter to."
f000046,348.480,352.160,"Could the alarm have failed to ring?"
f000047,352.160,356.520,"One saw from the bed that it was properly set for four o'clock."
f000048,356.520,358.680,"Certainly it had rung."
f000049,358.680,365.080,"Yes, but was it possible to sleep through that noise which made the furniture shake?"
f000050,365.080,372.240,"Now, it's true he'd not slept quietly, but evidently he'd slept all the more deeply."
f000051,372.240,375.000,"Still, what should he do now?"
f000052,375.000,377.120,"The next train left at seven o'clock."
f000053,377.120,381.920,"To catch that one, he would have to go in a mad rush."
f000054,381.920,388.800,"The sample collection wasn't packed up yet, and he really didn't feel particularly fresh and active."
f000055,388.800,401.520,"And even if he caught the train, there was no avoiding a blowup with the boss, because the firm's errand boy would've waited for the five o'clock train and reported the news of his absence long ago."
f000056,401.520,407.040,"He was the boss's minion, without backbone or intelligence."
f000057,407.040,410.680,"Well then, what if he reported in sick?"
f000058,410.680,421.000,"But that would be extremely embarrassing and suspicious, because during his five years' service Gregor hadn't been sick even once."
f000059,421.000,441.240,"The boss would certainly come with the doctor from the health insurance company and would reproach his parents for their lazy son and cut short all objections with the insurance doctor's comments; for him everyone was completely healthy but really lazy about work."
f000060,441.240,446.200,"And besides, would the doctor in this case be totally wrong?"
f000061,446.200,457.440,"Apart from a really excessive drowsiness after the long sleep, Gregor in fact felt quite well and even had a really strong appetite."
f000062,457.440,474.640,"As he was thinking all this over in the greatest haste, without being able to make the decision to get out of bed—the alarm clock was indicating exactly quarter to seven—there was a cautious knock on the door by the head of the bed."
f000063,474.640,481.040,"Gregor, a voice called—it was his mother!—it's quarter to seven."
f000064,481.040,482.680,"Don't you want to be on your way?"
f000065,482.680,486.160,"The soft voice!"
f000066,486.160,490.240,"Gregor was startled when he heard his voice answering."
f000067,490.240,514.280,"It was clearly and unmistakably his earlier voice, but in it was intermingled, as if from below, an irrepressibly painful squeaking, which left the words positively distinct only in the first moment and distorted them in the reverberation, so that one didn't know if one had heard correctly."
f000068,514.280,525.520,"Gregor wanted to answer in detail and explain everything, but in these circumstances he confined himself to saying, Yes, yes, thank you mother."
f000069,525.520,527.280,"I'm getting up right away."
f000070,527.280,539.960,"Because of the wooden door the change in Gregor's voice was not really noticeable outside, so his mother calmed down with this explanation and shuffled off."
f000071,539.960,556.200,"However, as a result of the short conversation, the other family members became aware that Gregor was unexpectedly still at home, and already his father was knocking on one side door, weakly but with his fist."
f000072,556.200,560.440,"Gregor, Gregor, he called out, what's going on?"
f000073,560.440,564.720,"And, after a short while, he urged him on again in a deeper voice: Gregor!"
f000074,564.720,566.960,"Gregor!"
f000075,566.960,570.920,"At the other side door, however, his sister knocked lightly."
f000076,570.920,571.840,"Gregor?"
f000077,571.840,572.840,"Are you all right?"
f000078,572.840,575.880,"Do you need anything?"
f000079,575.880,582.200,"Gregor directed answers in both directions, I'll be ready right away."
f000080,582.200,595.200,"He made an effort with the most careful articulation and by inserting long pauses between the individual words to remove everything remarkable from his voice."
f000081,595.200,598.720,"His father turned back to his breakfast."
f000082,598.720,603.800,"However, the sister whispered, Gregor, open the door—I beg you."
f000083,603.800,616.920,"Gregor had no intention of opening the door, but congratulated himself on his precaution, acquired from travelling, of locking all doors during the night, even at home."
f000084,616.920,639.280,"First he wanted to stand up quietly and undisturbed, get dressed, above all have breakfast, and only then consider further action, for—he noticed this clearly—by thinking things over in bed he would not reach a reasonable conclusion."
f000085,639.280,658.520,"He remembered that he had already often felt a light pain or other in bed, perhaps the result of an awkward lying position, which later turned out to be purely imaginary when he stood up, and he was eager to see how his present fantasies would gradually dissipate."
f000086,658.520,670.480,"That the change in his voice was nothing other than the onset of a real chill, an occupational illness of commercial travellers, of that he had not the slightest doubt."
f000087,670.480,675.280,"It was very easy to throw aside the blanket."
f000088,675.280,680.120,"He needed only to push himself up a little, and it fell by itself."
f000089,680.120,686.400,"But to continue was difficult, particularly because he was so unusually wide."
f000090,686.400,692.160,"He needed arms and hands to push himself upright."
f000091,692.160,706.960,"Instead of these, however, he had only many small limbs which were incessantly moving with very different motions and which, in addition, he was unable to control."
f000092,706.960,726.040,"If he wanted to bend one of them, then it was the first to extend itself, and if he finally succeeded doing what he wanted with this limb, in the meantime all the others, as if left free, moved around in an excessively painful agitation."
f000093,726.040,734.960,"But I must not stay in bed uselessly, said Gregor to himself."
f000094,734.960,751.040,"At first he wanted to get out of bed with the lower part of his body, but this lower part—which, by the way, he had not yet looked at and which he also couldn't picture clearly—proved itself too difficult to move."
f000095,751.040,755.400,"The attempt went so slowly."
f000096,755.400,769.520,"When, having become almost frantic, he finally hurled himself forward with all his force and without thinking, he chose his direction incorrectly, and he hit the lower bedpost hard."
f000097,769.520,778.320,"The violent pain he felt revealed to him that the lower part of his body was at the moment probably the most sensitive."
f000098,778.320,787.640,"Thus, he tried to get his upper body out of the bed first and turned his head carefully toward the edge of the bed."
f000099,787.640,798.960,"He managed to do this easily, and in spite of its width and weight his body mass at last slowly followed the turning of his head."
f000100,798.960,816.040,"But as he finally raised his head outside the bed in the open air, he became anxious about moving forward any further in this manner, for if he allowed himself eventually to fall by this process, it would take a miracle to prevent his head from getting injured."
f000101,816.040,820.920,"And at all costs he must not lose consciousness right now."
f000102,820.920,825.520,"He preferred to remain in bed."
f000103,825.520,861.040,"However, after a similar effort, while he lay there again, sighing as before, and once again saw his small limbs fighting one another, if anything worse than earlier, and didn't see any chance of imposing quiet and order on this arbitrary movement, he told himself again that he couldn't possibly remain in bed and that it might be the most reasonable thing to sacrifice everything if there was even the slightest hope of getting himself out of bed in the process."
f000104,861.040,876.560,"At the same moment, however, he didn't forget to remind himself from time to time of the fact that calm—indeed the calmest—reflection might be better than the most confused decisions."
f000105,876.560,895.280,"At such moments, he directed his gaze as precisely as he could toward the window, but unfortunately there was little confident cheer to be had from a glance at the morning mist, which concealed even the other side of the narrow street."
f000106,895.280,906.960,"It's already seven o'clock, he told himself at the latest striking of the alarm clock, already seven o'clock and still such a fog."
f000107,906.960,919.640,"And for a little while longer he lay quietly with weak breathing, as if perhaps waiting for normal and natural conditions to reemerge out of the complete stillness."
f000108,919.640,930.480,"But then he said to himself, Before it strikes a quarter past seven, whatever happens I must be completely out of bed."
f000109,930.480,939.480,"Besides, by then someone from the office will arrive to inquire about me, because the office will open before seven o'clock."
f000110,939.480,946.000,"And he made an effort then to rock his entire body length out of the bed with a uniform motion."
f000111,946.000,958.400,"If he let himself fall out of the bed in this way, his head, which in the course of the fall he intended to lift up sharply, would probably remain uninjured."
f000112,958.400,966.360,"His back seemed to be hard; nothing would really happen to that as a result of the fall."
f000113,966.360,980.040,"His greatest reservation was a worry about the loud noise which the fall must create and which presumably would arouse, if not fright, then at least concern on the other side of all the doors."
f000114,980.040,985.160,"However, it had to be tried."
f000115,985.160,1002.000,"As Gregor was in the process of lifting himself half out of bed—the new method was more of a game than an effort; he needed only to rock with a constant rhythm—it struck him how easy all this would be if someone were to come to his aid."
f000116,1002.000,1009.560,"Two strong people—he thought of his father and the servant girl—would have been quite sufficient."
f000117,1009.560,1029.520,"They would have only had to push their arms under his arched back to get him out of the bed, to bend down with their load, and then merely to exercise patience and care that he completed the flip onto the floor, where his diminutive legs would then, he hoped, acquire a purpose."
f000118,1029.520,1037.000,"Now, quite apart from the fact that the doors were locked, should he really call out for help?"
f000119,1037.000,1044.240,"In spite of all his distress, he was unable to suppress a smile at this idea."
f000120,1044.240,1060.000,"He had already got to the point where, by rocking more strongly, he maintained his equilibrium with difficulty, and very soon he would finally have to decide, for in five minutes it would be a quarter past seven."
f000121,1060.000,1064.040,"Then there was a ring at the door of the apartment."
f000122,1064.040,1072.800,"That's someone from the office, he told himself, and he almost froze while his small limbs only danced around all the faster."
f000123,1072.800,1076.800,"For one moment everything remained still."
f000124,1076.800,1084.120,"They aren't opening, Gregor said to himself, caught up in some absurd hope."
f000125,1084.120,1091.440,"But of course then, as usual, the servant girl with her firm tread went to the door and opened it."
f000126,1091.440,1101.400,"Gregor needed to hear only the first word of the visitor's greeting to recognize immediately who it was, the manager himself."
f000127,1101.400,1113.160,"Why was Gregor the only one condemned to work in a firm where, at the slightest lapse, someone immediately attracted the greatest suspicion?"
f000128,1113.160,1119.400,"Were all the employees then collectively, one and all, scoundrels?"
f000129,1119.400,1135.640,"Among them was there then no truly devoted person who, if he failed to use just a couple of hours in the morning for office work, would become abnormal from pangs of conscience and really be in no state to get out of bed?"
f000130,1135.640,1142.240,"Was it really not enough to let an apprentice make inquiries, if such questioning was even necessary?"
f000131,1142.240,1157.600,"Must the manager himself come, and in the process must it be demonstrated to the entire innocent family that the investigation of this suspicious circumstance could be entrusted only to the intelligence of the manager?"
f000132,1157.600,1171.160,"And more as a consequence of the excited state in which this idea put Gregor than as a result of an actual decision, he swung himself with all his might out of the bed."
f000133,1171.160,1175.520,"There was a loud thud, but not a real crash."
f000134,1175.520,1185.000,"The fall was absorbed somewhat by the carpet and, in addition, his back was more elastic than Gregor had thought."
f000135,1185.000,1190.640,"For that reason the dull noise was not quite so conspicuous."
f000136,1190.640,1196.000,"But he had not held his head up with sufficient care and had hit it."
f000137,1196.000,1202.040,"He turned his head, irritated and in pain, and rubbed it on the carpet."
f000138,1202.040,1207.880,"Something has fallen in there, said the manager in the next room on the left."
f000139,1207.880,1218.280,"Gregor tried to imagine to himself whether anything similar to what was happening to him today could have also happened at some point to the manager."
f000140,1218.280,1222.880,"At least one had to concede the possibility of such a thing."
f000141,1222.880,1235.120,"However, as if to give a rough answer to this question, the manager now, with a squeak of his polished boots, took a few determined steps in the next room."
f000142,1235.120,1244.600,"From the neighbouring room on the right the sister was whispering to inform Gregor: Gregor, the manager is here."
f000143,1244.600,1246.840,"I know, said Gregor to himself."
f000144,1246.840,1251.720,"But he did not dare make his voice loud enough so that his sister could hear."
f000145,1251.720,1262.880,"Gregor, his father now said from the neighbouring room on the left, Mr. Manager has come and is asking why you have not left on the early train."
f000146,1262.880,1265.720,"We don't know what we should tell him."
f000147,1265.720,1270.000,"Besides, he also wants to speak to you personally."
f000148,1270.000,1271.960,"So please open the door."
f000149,1271.960,1275.600,"He will be good enough to forgive the mess in your room."
f000150,1275.600,1283.000,"In the middle of all this, the manager called out in a friendly way, Good morning, Mr. Samsa."
f000151,1283.000,1293.560,"He is not well, said his mother to the manager, while his father was still talking at the door, He is not well, believe me, Mr. Manager."
f000152,1293.560,1296.560,"Otherwise how would Gregor miss a train?"
f000153,1296.560,1300.320,"The young man has nothing in his head except business."
f000154,1300.320,1303.440,"I'm almost angry that he never goes out at night."
f000155,1303.440,1309.360,"Right now he's been in the city eight days, but he's been at home every evening."
f000156,1309.360,1317.000,"He sits here with us at the table and reads the newspaper quietly or studies his travel schedules."
f000157,1317.000,1321.920,"It's a quite a diversion for him to busy himself with fretwork."
f000158,1321.920,1327.640,"For instance, he cut out a small frame over the course of two or three evenings."
f000159,1327.640,1329.960,"You'd be amazed how pretty it is."
f000160,1329.960,1332.240,"It's hanging right inside the room."
f000161,1332.240,1335.600,"You'll see it immediately, as soon as Gregor opens the door."
f000162,1335.600,1338.840,"Anyway, I'm happy that you're here, Mr. Manager."
f000163,1338.840,1342.920,"By ourselves, we would never have made Gregor open the door."
f000164,1342.920,1349.360,"He's so stubborn, and he's certainly not well, although he denied that this morning."
f000165,1349.360,1361.000,"I'm coming right away, said Gregor slowly and deliberately and didn't move, so as not to lose one word of the conversation."
f000166,1361.000,1369.640,"My dear lady, I cannot explain it to myself in any other way, said the manager; I hope it is nothing serious."
f000167,1369.640,1383.440,"On the other hand, I must also say that we business people, luckily or unluckily, however one looks at it, very often simply have to overcome a slight indisposition for business reasons."
f000168,1383.440,1391.640,"So can Mr. Manager come in to see you now? asked his father impatiently and knocked once again on the door."
f000169,1391.640,1393.640,"No, said Gregor."
f000170,1393.640,1398.960,"In the neighbouring room on the left a painful stillness descended."
f000171,1398.960,1404.400,"In the neighbouring room on the right the sister began to sob."
f000172,1404.400,1408.640,"Why didn't his sister go to the others?"
f000173,1408.640,1414.520,"She'd probably just gotten up out of bed now and hadn't even started to get dressed yet."
f000174,1414.520,1416.840,"Then why was she crying?"
f000175,1416.840,1430.400,"Because he wasn't getting up and wasn't letting the manager in, because he was in danger of losing his position, and because then his boss would badger his parents once again with the old demands?"
f000176,1430.400,1434.560,"Those were probably unnecessary worries right now."
f000177,1434.560,1440.680,"Gregor was still here and wasn't thinking at all about abandoning his family."
f000178,1440.680,1451.480,"At the moment he was lying right there on the carpet, and no one who knew about his condition would've seriously demanded that he let the manager in."
f000179,1451.480,1462.960,"But Gregor wouldn't be casually dismissed right way because of this small discourtesy, for which he would find an easy and suitable excuse later on."
f000180,1462.960,1474.080,"It seemed to Gregor that it might be far more reasonable to leave him in peace at the moment, instead of disturbing him with crying and conversation."
f000181,1474.080,1481.200,"But it was the very uncertainty which distressed the others and excused their behaviour."
f000182,1481.200,1488.520,"Mr. Samsa, the manager was now shouting, his voice raised, what's the matter?"
f000183,1488.520,1506.640,"You are barricading yourself in your room, answer with only a yes and a no, are making serious and unnecessary troubles for your parents, and neglecting I mention this only incidentally your commercial duties in a truly unheard of manner."
f000184,1506.640,1518.400,"I am speaking here in the name of your parents and your employer, and I am requesting you in all seriousness for an immediate and clear explanation."
f000185,1518.400,1520.640,"I am amazed."
f000186,1520.640,1522.560,"I am amazed."
f000187,1522.560,1531.680,"I thought I knew you as a calm, reasonable person, and now you appear suddenly to want to start parading around in weird moods."
f000188,1531.680,1549.960,"The Chief indicated to me earlier this very day a possible explanation for your neglectit concerned the collection of cash entrusted to you a short while agobut in truth I almost gave him my word of honour that this explanation could not be correct."
f000189,1549.960,1560.480,"However, now I see here your unimaginable pig headedness, and I am totally losing any desire to speak up for you in the slightest."
f000190,1560.480,1564.360,"And your position is not at all the most secure."
f000191,1564.360,1575.560,"Originally I intended to mention all this to you privately, but since you are letting me waste my time here uselessly, I don't know why the matter shouldn't come to the attention of your parents."
f000192,1575.560,1581.000,"Your productivity has also been very unsatisfactory recently."
f000193,1581.000,1596.880,"Of course, it's not the time of year to conduct exceptional business, we recognize that, but a time of year for conducting no business, there is no such thing at all, Mr. Samsa, and such a thing must never be."
f000194,1596.880,1608.160,"But Mr. Manager, called Gregor, beside himself and, in his agitation, forgetting everything else, I'm opening the door immediately, this very moment."
f000195,1608.160,1613.680,"A slight indisposition, a dizzy spell, has prevented me from getting up."
f000196,1613.680,1616.360,"I'm still lying in bed right now."
f000197,1616.360,1618.920,"But I'm quite refreshed once again."
f000198,1618.920,1621.400,"I'm in the midst of getting out of bed."
f000199,1621.400,1623.800,"Just have patience for a short moment!"
f000200,1623.800,1626.760,"Things are not going as well as I thought."
f000201,1626.760,1629.000,"But things are all right."
f000202,1629.000,1631.800,"How suddenly this can overcome someone!"
f000203,1631.800,1635.280,"Only yesterday evening everything was fine with me."
f000204,1635.280,1637.320,"My parents certainly know that."
