,book,DE_audio,EN_audio,score,DE_transcript,EN_transcript
330,9.bildnis_dorian_gray_ak_librivox_64kb_mp3,00007-das_bildnis_363.flac,00007-f000321,0.820312,"Aber es sah nach ihm hin mit seinem schönen, entstellten Gesicht und seinem grausamen Lächeln.","Yet it was watching him, with its beautiful marred face and its cruel smile."
331,9.bildnis_dorian_gray_ak_librivox_64kb_mp3,00007-das_bildnis_364.flac,00007-f000322,0.24,Sein leuchtendes Haar glänzte im Schein der Frühsonne.,Its bright hair gleamed in the early sunlight.
332,9.bildnis_dorian_gray_ak_librivox_64kb_mp3,00007-das_bildnis_365.flac,00007-f000323,0.496753,Seine blauen Augen blickten in die seinigen.,Its blue eyes met his own.
333,9.bildnis_dorian_gray_ak_librivox_64kb_mp3,00007-das_bildnis_366.flac,00007-f000324,0.820728,"Ein Gefühl unendlichen Mitleids, nicht mit sich selbst, sondern mit seinem gemalten Abbild überkam ihn.","A sense of infinite pity, not for himself, but for the painted image of himself, came over him."
334,9.bildnis_dorian_gray_ak_librivox_64kb_mp3,00007-das_bildnis_367.flac,00007-f000325,1.16923,Es hatte sich schon verändert und würde sich noch mehr verändern.,"It had altered already, and would alter more."
335,9.bildnis_dorian_gray_ak_librivox_64kb_mp3,00007-das_bildnis_369.flac,00007-f000328,0.453125,"Für jede Sünde, die er beginge, würde ein Mal seine Schönheit beflecken und verderben.","For every sin that he committed, a stain would fleck and wreck its fairness."
336,9.bildnis_dorian_gray_ak_librivox_64kb_mp3,00007-das_bildnis_370.flac,00007-f000329,0.65,Aber er wollte nicht sündigen.,But he would not sin.
337,9.bildnis_dorian_gray_ak_librivox_64kb_mp3,00007-das_bildnis_371.flac,00007-f000330,0.445833,"Das Bild, ob verändert oder unverändert, sollte ihm das sichtbare Wahrzeichen des Gewissens sein.","The picture, changed or unchanged, would be to him the visible emblem of conscience."
338,9.bildnis_dorian_gray_ak_librivox_64kb_mp3,00007-das_bildnis_372.flac,00007-f000331,0.792,Er wollte der Versuchung widerstehen.,He would resist temptation.
339,9.bildnis_dorian_gray_ak_librivox_64kb_mp3,00007-das_bildnis_373.flac,00007-f000332,0.94957,"Er wollte Lord Henry nicht mehr sehn wollte jedenfalls nicht mehr auf die feinen vergifteten Theorien hören, die in Basil Hallwards Garten zuerst in ihm die Leidenschaft für Dinge, die nicht möglich sind, erregt hatten.","He would not see Lord Henry any more would not, at any rate, listen to those subtle poisonous theories that in Basil Hallward's garden had first stirred within him the passion for impossible things."
340,9.bildnis_dorian_gray_ak_librivox_64kb_mp3,00007-das_bildnis_374.flac,00007-f000333,1.00796,"Er wollte zu Sibyl Vane zurückgehen, ihre Fehler verbessern, sie heiraten und versuchen, sie wieder zu lieben.","He would go back to Sibyl Vane, make her amends, marry her, try to love her again."
341,9.bildnis_dorian_gray_ak_librivox_64kb_mp3,00007-das_bildnis_375.flac,00007-f000334,0.879167,"Ja, es war seine Pflicht, das zu tun.","Yes, it was his duty to do so."
342,9.bildnis_dorian_gray_ak_librivox_64kb_mp3,00007-das_bildnis_376.flac,00007-f000335,1.03125,Sie mußte mehr als er gelitten haben.,She must have suffered more than he had.
343,9.bildnis_dorian_gray_ak_librivox_64kb_mp3,00007-das_bildnis_377.flac,00007-f000336,0.3,Armes Kind!,Poor child !
344,9.bildnis_dorian_gray_ak_librivox_64kb_mp3,00007-das_bildnis_378.flac,00007-f000337,0.831183,Er war selbstsüchtig und grausam gegen sie gewesen.,He had been selfish and cruel to her.
345,9.bildnis_dorian_gray_ak_librivox_64kb_mp3,00007-das_bildnis_379.flac,00007-f000338,0.834134,"Der Zauber, den sie auf ihn ausgeübt hatte, würde zurückkehren.",The fascination that she had exercised over him would return.
