,book,DE_audio,EN_audio,score,DE_transcript,EN_transcript
226,9.bildnis_dorian_gray_ak_librivox_64kb_mp3,00018-das_bildnis_255.flac,00018-f000248,0.1425,Er klammerte sich leidenschaftlich an sie an.,The folk don't like to have that sort of thing in their houses.
227,9.bildnis_dorian_gray_ak_librivox_64kb_mp3,00018-das_bildnis_256.flac,00018-f000248,0.1425,Wo liegt der Leichnam? rief er.,<MERGE> The folk don't like to have that sort of thing in their houses.
228,9.bildnis_dorian_gray_ak_librivox_64kb_mp3,00018-das_bildnis_258.flac,00018-f000249,-0.0103448,Ich muß ihn sofort sehn.,<MERGE> They say a corpse brings bad luck.
229,9.bildnis_dorian_gray_ak_librivox_64kb_mp3,00018-das_bildnis_260.flac,00018-f000250,0.8914290000000001,Die Leute mögen so was nicht in ihrem Haus.,The Home Farm Go there at once and meet me.
230,9.bildnis_dorian_gray_ak_librivox_64kb_mp3,00018-das_bildnis_261.flac,00018-f000249,0.676847,"Sie sagen, eine Leiche bringt Unglück!",They say a corpse brings bad luck.
231,9.bildnis_dorian_gray_ak_librivox_64kb_mp3,00018-das_bildnis_262.flac,00018-f000252,0.27,Home Farm!,Never mind.
232,9.bildnis_dorian_gray_ak_librivox_64kb_mp3,00018-das_bildnis_264.flac,00018-f000251,0.578788,Sie sofort hin und warten Sie auf mich!,Tell one of the grooms to bring my horse round.
233,9.bildnis_dorian_gray_ak_librivox_64kb_mp3,00018-das_bildnis_266.flac,00018-f000254,0.825,"Nein, ist nicht nötig.",It will save time.
234,9.bildnis_dorian_gray_ak_librivox_64kb_mp3,00018-das_bildnis_267.flac,00018-f000254,0.46875,"Ich gehe selbst zum Stall, es geht schneller.",It will save time.
235,9.bildnis_dorian_gray_ak_librivox_64kb_mp3,00018-das_bildnis_268.flac,00018-f000255,0.6678569999999999,"Nach kaum einer Viertelstunde galoppierte Dorian Gray, so schnell er konnte, die lange Allee hinab.",In less than a quarter of an hour Dorian Gray was galloping down the long avenue as hard as he could go.
236,9.bildnis_dorian_gray_ak_librivox_64kb_mp3,00018-das_bildnis_269.flac,00018-f000256,0.6,Die Bäume schienen in gespenstigem Zuge an ihm vorbeizufliegen und wilde Schatten sich ihm in den Weg zu werfen.,"The trees seemed to sweep past him in spectral procession, and wild shadows to fling themselves across his path."
237,9.bildnis_dorian_gray_ak_librivox_64kb_mp3,00018-das_bildnis_270.flac,00018-f000257,0.670972,Einmal scheute das Pferd vor einem weißen Pfosten und warf seinen Reiter fast ab.,Once the mare swerved at a white gatepost and nearly threw him.
238,9.bildnis_dorian_gray_ak_librivox_64kb_mp3,00018-das_bildnis_271.flac,00018-f000258,1.16757,Er schlug dem Tier die Peitsche über den Nacken.,He lashed her across the neck with his crop.
239,9.bildnis_dorian_gray_ak_librivox_64kb_mp3,00018-das_bildnis_273.flac,00018-f000261,1.03929,Endlich hielt er an der Home Farm.,At last he reached the Home Farm.
240,9.bildnis_dorian_gray_ak_librivox_64kb_mp3,00018-das_bildnis_274.flac,00018-f000262,0.725,Zwei Männer standen im Hof.,Two men were loitering in the yard.
241,9.bildnis_dorian_gray_ak_librivox_64kb_mp3,00018-das_bildnis_275.flac,00018-f000263,0.523333,Er sprang aus dem Sattel und warf einem die Zügel hin.,He leapt from the saddle and threw the reins to one of them.
242,9.bildnis_dorian_gray_ak_librivox_64kb_mp3,00018-das_bildnis_276.flac,00018-f000264,0.247059,Im letzten Stall schimmerte ein Licht.,In the farthest stable a light was glimmering.
243,9.bildnis_dorian_gray_ak_librivox_64kb_mp3,00018-das_bildnis_277.flac,00018-f000265,0.928654,"Ihm war es, als ob da die Leiche liegen müsse; er eilte zur Tür und legte die Hand auf die Klinke.","Something seemed to tell him that the body was there, and he hurried to the door, and put his hand upon the latch."
244,9.bildnis_dorian_gray_ak_librivox_64kb_mp3,00018-das_bildnis_278.flac,00018-f000266,0.0684868,Da hielt er einen Augenblick inne.,"There he paused for a moment, feeling that he was on the brink of a discovery that would either make or mar his life."
245,9.bildnis_dorian_gray_ak_librivox_64kb_mp3,00018-das_bildnis_279.flac,00018-f000266,0.0684868,"Er fühlte, daß er vor einer Entdeckung stand, die sein Leben entweder rettete oder zerstörte.","<MERGE> There he paused for a moment, feeling that he was on the brink of a discovery that would either make or mar his life."
246,9.bildnis_dorian_gray_ak_librivox_64kb_mp3,00018-das_bildnis_280.flac,00018-f000267,1.28235,Dann warf er die Tür zurück und trat ein.,"Then he thrust the door open, and entered."
247,9.bildnis_dorian_gray_ak_librivox_64kb_mp3,00018-das_bildnis_281.flac,00018-f000268,0.865368,Auf einem Haufen Sackleinwand am Ende des Stalles lag die Leiche eines Mannes in einer groben Bluse und blauen Hosen.,On a heap of sacking in the far 'corner was lying the dead body of a man dressed in a coarse shirt and a pair of blue trousers.
