,book,DE_audio,EN_audio,score,DE_transcript,EN_transcript
74,23.reise_um_die_erde_in_80_tagen_1510_librivox,00022-in80tagen_87.flac,00022-f000081,0.526071,"Hier schimmerten im letzten Farbenschmuck und Blüthenduft glänzende Camelien, nicht auf Sträuchern, sondern Bäumen, und in Bambusgehägen Kirsch, Pflaumen und Aepfelbäume, deren Früchte sie durch Fratzenmännchen, Scheuchklappern gegen den gefräßigen Schnabel der Sperlinge, Tauben, Raben und anderen Gevögels schützen.","There he saw dazzling camelias expanding themselves, with flowers which were giving forth their last colours and perfumes, not on bushes, but on trees; and within bamboo enclosures, cherry, plum, and apple trees, which the Japanese cultivate rather for their blossoms than their fruit, and which queerlyfashioned grinning scarescrows protected from the sparrows, pigeons, ravens, and other voracious birds."
75,23.reise_um_die_erde_in_80_tagen_1510_librivox,00022-in80tagen_88.flac,00022-f000082,0.357099,"Da hausen auf den majestätischen Cedern gewaltige Adler; Reiher bergen sich unter den Zweigen der Trauerweiden; überall flattern Krähen, Enten, Sperber, wilde Gänse und Kraniche, die bei den Japanesen sehr in Ehren stehen.","On the branches of the cedars were perched large eagles; amid the foliage of the weeping willows were herons, solemnly standing on one leg; and on every hand were crows, ducks, hawks, wild birds, and a multitude of cranes, which the Japanese con sider sacred, and which to their minds symbolize long life and prosperity."
76,23.reise_um_die_erde_in_80_tagen_1510_librivox,00022-in80tagen_91.flac,00022-f000089,0.487141,"Darin irrte er nicht, aber sein Magen hätte sich auch mit Wildpret, Geflügel oder Fischen begnügt, womit die Japanesen fast ausschließlich sich nähren, außer den Gerichten von Reis.","He ob served that the butchers' stalls contained neither mutton, goat, nor pork; and knowing also that it is a sacrilege to kill cattle, which are preserved solely for farming, he made up his mind that meat was far from plentiful in Yokohama, — nor was he mistaken; and in default of butcher's meat; he could have wished for a quarter of wild boar or deer, a partridge, or some quails, some game or fish, which, with, rice, the Japanese eat almost exclusively."
77,23.reise_um_die_erde_in_80_tagen_1510_librivox,00022-in80tagen_92.flac,00022-f000090,0.7212770000000001,Aber er mußte für heute sich gutwillig in sein Geschick fügen und die Nahrungssorge auf den nächsten Morgen verschieben.,"But he found it necessary to keep up a stout heart, and to postpone the meal he craved till the following morning."
78,23.reise_um_die_erde_in_80_tagen_1510_librivox,00022-in80tagen_93.flac,00022-f000091,0.12649100000000002,Die Nacht kam heran.,"Night came, and Passepartout reentered the native quarter, where he wandered through the streets, lit by varicoloured lanterns, looking on at the dancers who were executing skilful steps and boundings, and the astrologers who stood in the open air with their telescopes."
79,23.reise_um_die_erde_in_80_tagen_1510_librivox,00022-in80tagen_94.flac,00022-f000091,0.12649100000000002,"Passepartout begab sich wieder in den Stadttheil der Eingeborenen und schweifte in den Straßen herum zwischen bunten Laternen, sah den Possenreißern zu, die in Gruppen ihre Zauberkünste sehen ließen, und den Astrologen, welche in freier Luft die schaulustige Menge um ihr Fernrohr sammelten.","<MERGE> Night came, and Passepartout reentered the native quarter, where he wandered through the streets, lit by varicoloured lanterns, looking on at the dancers who were executing skilful steps and boundings, and the astrologers who stood in the open air with their telescopes."
80,23.reise_um_die_erde_in_80_tagen_1510_librivox,00022-in80tagen_95.flac,00022-f000092,0.506727,"Nachher besuchte er wieder die Rhede, welche im Glanz der Fischerfeuer prangte, die mit dem Schein ihrer Harzfackeln die Fische herbeilocken.","Then. he came to the harbour, which was lit.up by the rosin torches of the fishermen, who were fishing from their boats."
81,23.reise_um_die_erde_in_80_tagen_1510_librivox,00022-in80tagen_97.flac,00022-f000096,0.697911,"Diese Beamten in ihrer prachtvollen Uniform und von ihrem Gefolge umgeben, nahmen sich wie Gesandtschaften aus, und Passepartout rief scherzend, so oft er so einer glänzenden Patrouille begegnete.","The streets at last became quiet, and the patrol, the officers of which, in their splendid costumes, and sur rounded by their suites, Passepartout thought seemed like ambassadors, succeeded the bustling crowd."
